A1: File Name | B1: Date | C1: Time | D1: Exposure | E1: Description | F1: Aimed RA | G1: Aimed DEC | H1: Actual RA | I1: Actual DEC
A2: CAMARILLO-002.FIT | B2: 38356 | D2: 26 | E2: CAMARILLO' | F2: 4.4666699999999997 | G2: 45.816110000000002 | H2: 4.4608100000000004 | I2: 45.812759999999997
A3: CAMARILLO-004.FIT | B3: 38356 | D3: 26 | E3: CAMARILLO' | F3: 4.4666699999999997 | G3: 45.816110000000002 | H3: 4.4609399999999999 | I3: 45.819499999999998
A4: CAMARILLO-006.FIT | B4: 38356 | D4: 26 | E4: CAMARILLO' | F4: 4.4666699999999997 | G4: 45.816110000000002 | H4: 4.4613100000000001 | I4: 45.813580000000002
A5: DUBOSHIN-005.FIT | B5: 38356 | C5: 0.80295138888888884 | D5: 26 | E5: DUBOSHIN' | F5: 2.58222 | G5: 14.48278 | H5: 0 | I5: 0
A6: VENUSIA-005.FIT | B6: 38356 | C6: 0.80488425925925933 | D6: 26 | E6: VENUSIA' | F6: 2.4344399999999999 | G6: 15.41611 | H6: 0 | I6: 0
A7: 2000 AS152-001.FIT | B7: 38356 | D7: 26 | E7: 2000 AS152' | F7: 3.8133300000000001 | G7: 25.183330000000002 | H7: 3.81027 | I7: 25.15898
A8: 2000 AS152-004.FIT | B8: 38356 | D8: 26 | E8: 2000 AS152' | F8: 3.8133300000000001 | G8: 25.16611 | H8: 3.8085800000000001 | I8: 25.153870000000001
A9: 2000 AS152-006.FIT | B9: 38356 | D9: 26 | E9: 2000 AS152' | F9: 3.8133300000000001 | G9: 25.16639 | H9: 3.8085200000000001 | I9: 25.163599999999999
A10: ISMENE-005.FIT | B10: 38356 | C10: 0.8068981481481482 | D10: 26 | E10: ISMENE' | F10: 2.0088900000000001 | G10: 6.5661100000000001 | H10: 0 | I10: 0
A11: DUBOSHIN-001.FIT | B11: 38356 | D11: 26 | E11: DUBOSHIN' | F11: 2.58222 | G11: 14.48278 | H11: 2.5769500000000001 | I11: 14.489269999999999
A12: DUBOSHIN-003.FIT | B12: 38356 | D12: 26 | E12: DUBOSHIN' | F12: 2.58222 | G12: 14.48278 | H12: 2.5769099999999998 | I12: 14.48258
A13: DUBOSHIN-006.FIT | B13: 38356 | D13: 26 | E13: DUBOSHIN' | F13: 2.58222 | G13: 14.48278 | H13: 2.5778599999999998 | I13: 14.47517
A14: SIMEISA-005.FIT | B14: 38356 | C14: 0.80886574074074069 | D14: 26 | E14: SIMEISA' | F14: 1.83111 | G14: 13.032780000000001 | H14: 0 | I14: 0
A15: LIBYA-005.FIT | B15: 38356 | C15: 0.81075231481481491 | D15: 26 | E15: LIBYA' | F15: 1.50444 | G15: 13.33306 | H15: 0 | I15: 0
A16: VENUSIA-002.FIT | B16: 38356 | D16: 26 | E16: VENUSIA' | F16: 2.4344399999999999 | G16: 15.41639 | H16: 2.4308200000000002 | I16: 15.403180000000001
A17: VENUSIA-003.FIT | B17: 38356 | D17: 26 | E17: VENUSIA' | F17: 2.4344399999999999 | G17: 15.41611 | H17: 2.4302199999999998 | I17: 15.394769999999999
A18: VENUSIA-006.FIT | B18: 38356 | D18: 26 | E18: VENUSIA' | F18: 2.4341699999999999 | G18: 15.41611 | H18: 2.4301200000000001 | I18: 15.40512
A19: ISMENE-001.FIT | B19: 38356 | D19: 26 | E19: ISMENE' | F19: 2.0088900000000001 | G19: 6.5494399999999997 | H19: 2.0039099999999999 | I19: 6.5316900000000002
A20: ISMENE-004.FIT | B20: 38356 | D20: 26 | E20: ISMENE' | F20: 2.00861 | G20: 6.5661100000000001 | H20: 2.0042 | I20: 6.5546699999999998
A21: ISMENE-006.FIT | B21: 38356 | D21: 26 | E21: ISMENE' | F21: 2.0088900000000001 | G21: 6.5661100000000001 | H21: 2.0050599999999998 | I21: 6.5433399999999997
A22: PHAETHON-006.FIT | B22: 38356 | C22: 0.8135648148148148 | D22: 26 | E22: PHAETHON' | F22: 1.39222 | G22: 17.599440000000001 | H22: 0 | I22: 0
A23: SIMEISA-001.FIT | B23: 38356 | D23: 26 | E23: SIMEISA' | F23: 1.83111 | G23: 13.032780000000001 | H23: 1.82745 | I23: 13.0166
A24: SIMEISA-004.FIT | B24: 38356 | D24: 26 | E24: SIMEISA' | F24: 1.83111 | G24: 13.032780000000001 | H24: 1.8270500000000001 | I24: 13.02294
A25: SIMEISA-006.FIT | B25: 38356 | D25: 26 | E25: SIMEISA' | F25: 1.83111 | G25: 13.032780000000001 | H25: 1.8269200000000001 | I25: 13.01568
A26: LIBYA-001.FIT | B26: 38356 | D26: 26 | E26: LIBYA' | F26: 1.50444 | G26: 13.33278 | H26: 1.5006999999999999 | I26: 13.303280000000001
A27: LIBYA-004.FIT | B27: 38356 | D27: 26 | E27: LIBYA' | F27: 1.50444 | G27: 13.33306 | H27: 1.5007900000000001 | I27: 13.30871
A28: LIBYA-006.FIT | B28: 38356 | D28: 26 | E28: LIBYA' | F28: 1.50444 | G28: 13.33306 | H28: 1.5004999999999999 | I28: 13.301270000000001
A29: PHAETHON-002.FIT | B29: 38356 | D29: 26 | E29: PHAETHON' | F29: 1.3944399999999999 | G29: 17.63278 | H29: 1.3897999999999999 | I29: 17.613610000000001
A30: PHAETHON-004.FIT | B30: 38356 | D30: 26 | E30: PHAETHON' | F30: 1.39333 | G30: 17.616669999999999 | H30: 1.3892199999999999 | I30: 17.59599
A31: PHAETHON-005.FIT | B31: 38356 | D31: 26 | E31: PHAETHON' | F31: 1.39222 | G31: 17.599440000000001 | H31: 1.38822 | I31: 17.55996
A32: PHAETHON-007.FIT | B32: 38356 | C32: 0.83163194444444455 | D32: 26 | E32: PHAETHON' | F32: 1.39222 | G32: 17.599440000000001 | H32: 0 | I32: 0
A33: 1988 XB-001.FIT | B33: 38356 | C33: 0.83390046296296294 | D33: 26 | E33: 1988 XB' | F33: 5.8022200000000002 | G33: 28.85 | H33: 0 | I33: 0
A34: 1988 XB-002.FIT | B34: 38356 | C34: 0.83446759259259251 | D34: 26 | E34: 1988 XB' | F34: 5.8044399999999996 | G34: 28.849440000000001 | H34: 0 | I34: 0
A35: PHAETHON-008.FIT | B35: 38356 | D35: 26 | E35: PHAETHON' | F35: 1.39222 | G35: 17.599440000000001 | H35: 1.38808 | I35: 17.56869
A36: 1988 XB-003.FIT | B36: 38356 | C36: 0.85105324074074085 | D36: 26 | E36: 1988 XB' | F36: 5.8022200000000002 | G36: 28.85 | H36: 0 | I36: 0
A37: XBb001.fit | B37: 38356 | D37: 26 | E37: ' | F37: 0 | G37: 0 | H37: 5.8005199999999997 | I37: 28.946960000000001
A38: XBb002.fit | B38: 38356 | D38: 26 | E38: ' | F38: 0 | G38: 0 | H38: 5.8005100000000001 | I38: 28.947389999999999
A39: 1988 XB-004.FIT | B39: 38356 | C39: 0.87769675925925927 | D39: 26 | E39: 1988 XB' | F39: 5.8022200000000002 | G39: 28.85 | H39: 0 | I39: 0
A40: XBc001.fit | B40: 38356 | D40: 26 | E40: ' | F40: 0 | G40: 0 | H40: 5.8019499999999997 | I40: 28.81015
A41: XBc002.fit | B41: 38356 | D41: 26 | E41: ' | F41: 0 | G41: 0 | H41: 5.8020899999999997 | I41: 28.80855
A42: XB001.fit | B42: 38356 | D42: 26 | E42: ' | F42: 0 | G42: 0 | H42: 5.80023 | I42: 28.850650000000002
A43: XB002.fit | B43: 38356 | D43: 26 | E43: ' | F43: 0 | G43: 0 | H43: 5.8003099999999996 | I43: 28.850390000000001
A44: 1988 XBa.fits | B44: 38356 | D44: 286 | E44: ' | F44: 0 | G44: 0 | H44: 5.8001800000000001 | I44: 28.850639999999999
A45: 1988 XBb.fits | B45: 38356 | D45: 234 | E45: ' | F45: 0 | G45: 0 | H45: 5.7974199999999998 | I45: 28.85078
A46: 1988 XBc.fits | B46: 38356 | D46: 182 | E46: ' | F46: 0 | G46: 0 | H46: 5.7970499999999996 | I46: 28.846119999999999
A47: Machholz-001.FIT | B47: 38356 | D47: 5 | E47: ' | F47: 3.7066699999999999 | G47: 17.08333 | H47: 3.6999200000000001 | I47: 17.074310000000001
A48: Machholz-002.FIT | B48: 38356 | D48: 5 | E48: ' | F48: 3.7066699999999999 | G48: 17.08333 | H48: 3.69991 | I48: 17.074449999999999
A49: Machholz.fits | B49: 38356 | D49: 75 | E49: ' | F49: 3.7066699999999999 | G49: 17.08333 | H49: 3.6999200000000001 | I49: 17.074310000000001
A50: M34-002.fit | B50: 38356 | D50: 20 | E50: ' | F50: 2.7022200000000001 | G50: 42.682780000000001 | H50: 2.7199200000000001 | I50: 42.75273
A51: M34-003.fit | B51: 38356 | D51: 20 | E51: ' | F51: 2.7030599999999998 | G51: 42.682780000000001 | H51: 2.7193999999999998 | I51: 42.74971
A52: M34.fits | B52: 38356 | D52: 66 | E52: ' | F52: 2.7022200000000001 | G52: 42.682780000000001 | H52: 2.7199200000000001 | I52: 42.75273
A53: M38-001.fit | B53: 38356 | D53: 26 | E53: ' | F53: 5.4811100000000001 | G53: 35.85 | H53: 5.4870900000000002 | I53: 35.858730000000001
A54: M38-002.fit | B54: 38356 | D54: 26 | E54: ' | F54: 5.4841699999999998 | G54: 35.916110000000003 | H54: 5.4873099999999999 | I54: 35.858519999999999
A55: M38.fits | B55: 38356 | D55: 52 | E55: ' | F55: 5.4811100000000001 | G55: 35.85 | H55: 5.4870900000000002 | I55: 35.858730000000001
A56: M67-001.fit | B56: 38356 | D56: 26 | E56: ' | F56: 8.86111 | G56: 11.799440000000001 | H56: 8.8591700000000007 | I56: 11.771850000000001
A57: M67-002.fit | B57: 38356 | D57: 26 | E57: ' | F57: 8.8644400000000001 | G57: 11.84972 | H57: 8.8590499999999999 | I57: 11.77026
A58: M67.fits | B58: 38356 | D58: 52 | E58: ' | F58: 8.86111 | G58: 11.799440000000001 | H58: 8.8591700000000007 | I58: 11.771850000000001
A59: 2004 QV13-001.FIT | B59: 38357 | C59: 0.86025462962962962 | D59: 26 | E59: 2004 QV13' | F59: 5.8811099999999996 | G59: 36.949440000000003 | H59: 0 | I59: 0
A60: 2004 QV13-002.FIT | B60: 38357 | C60: 0.86129629629629623 | D60: 26 | E60: 2004 QV13' | F60: 5.8811099999999996 | G60: 36.949440000000003 | H60: 0 | I60: 0
A61: QV13a001.fit | B61: 38357 | D61: 26 | E61: ' | F61: 0 | G61: 0 | H61: 23.996110000000002 | I61: -6.7030000000000006E-2
A62: QV13a002.fit | B62: 38357 | D62: 26 | E62: ' | F62: 0 | G62: 0 | H62: 23.996099999999998 | I62: -6.7239999999999994E-2
A63: 2004 QV13-003.FIT | B63: 38357 | C63: 0.88629629629629625 | D63: 26 | E63: 2004 QV13' | F63: 5.8811099999999996 | G63: 36.949440000000003 | H63: 0 | I63: 0
A64: 2004 QV13-004.FIT | B64: 38357 | C64: 0.88731481481481478 | D64: 26 | E64: 2004 QV13' | F64: 5.8811099999999996 | G64: 36.949440000000003 | H64: 0 | I64: 0
A65: QV13b006.fit | B65: 38357 | D65: 26 | E65: ' | F65: 0 | G65: 0 | H65: 5.87636 | I65: 36.952910000000003
A66: QV13b007.fit | B66: 38357 | D66: 26 | E66: ' | F66: 0 | G66: 0 | H66: 5.8762600000000003 | I66: 36.95261
A67: 2004 QV13-005.FIT | B67: 38357 | C67: 0.90670138888888896 | D67: 26 | E67: 2004 QV13' | F67: 5.88 | G67: 36.932780000000001 | H67: 0 | I67: 0
A68: 2004 QV13-006.FIT | B68: 38357 | C68: 0.90770833333333334 | D68: 26 | E68: 2004 QV13' | F68: 5.88 | G68: 36.932780000000001 | H68: 0 | I68: 0
A69: QV13c001.fit | B69: 38357 | D69: 26 | E69: ' | F69: 0 | G69: 0 | H69: 5.8747600000000002 | I69: 36.932470000000002
A70: QV13c002.fit | B70: 38357 | D70: 26 | E70: ' | F70: 0 | G70: 0 | H70: 5.8749099999999999 | I70: 36.932340000000003
A71: 2004 QV13-007.FIT | B71: 38357 | C71: 0.92658564814814814 | D71: 26 | E71: 2004 QV13' | F71: 5.88 | G71: 36.932780000000001 | H71: 0 | I71: 0
A72: 2004 QV13-008.FIT | B72: 38357 | C72: 0.9275810185185186 | D72: 26 | E72: 2004 QV13' | F72: 5.88 | G72: 36.932780000000001 | H72: 0 | I72: 0
A73: QV13d001.fit | B73: 38357 | D73: 26 | E73: ' | F73: 0 | G73: 0 | H73: 5.8742200000000002 | I73: 36.928359999999998
A74: QV13d002.fit | B74: 38357 | D74: 26 | E74: ' | F74: 0 | G74: 0 | H74: 5.8742000000000001 | I74: 36.927959999999999
A75: M108-001.FIT | B75: 38357 | C75: 0.95328703703703699 | D75: 26 | E75: ' | F75: 11.19806 | G75: 55.699440000000003 | H75: 0 | I75: 0
A76: M108-002.FIT | B76: 38357 | C76: 0.95385416666666656 | D76: 26 | E76: ' | F76: 11.202220000000001 | G76: 55.682780000000001 | H76: 0 | I76: 0
A77: M108-003.FIT | B77: 38357 | C77: 0.95479166666666659 | D77: 40 | E77: ' | F77: 11.202220000000001 | G77: 55.682780000000001 | H77: 0 | I77: 0
A78: M108-004.FIT | B78: 38357 | C78: 0.95600694444444445 | D78: 60 | E78: ' | F78: 11.203329999999999 | G78: 55.682780000000001 | H78: 0 | I78: 0
A79: 2004 QV13a.fits | B79: 38357 | D79: 208 | E79: ' | F79: 0 | G79: 0 | H79: 5.87622 | I79: 36.953699999999998
A80: 2004 QV13b.fits | B80: 38357 | D80: 260 | E80: ' | F80: 0 | G80: 0 | H80: 5.87636 | I80: 36.952910000000003
A81: 2004 QV13c.fits | B81: 38357 | D81: 338 | E81: ' | F81: 0 | G81: 0 | H81: 5.8747600000000002 | I81: 36.932490000000001
A82: 2004 QV13d.fits | B82: 38357 | D82: 312 | E82: ' | F82: 0 | G82: 0 | H82: 5.8742200000000002 | I82: 36.928330000000003
A83: 1988 XT1-003.FIT | B83: 38362 | D83: 26 | E83: 1988 XT1' | F83: 5.2166699999999997 | G83: 46.46611 | H83: 5.2105600000000001 | I83: 46.463880000000003
A84: 1988 XT1-006.FIT | B84: 38362 | D84: 26 | E84: 1988 XT1' | F84: 5.2166699999999997 | G84: 46.449440000000003 | H84: 5.2108499999999998 | I84: 46.459829999999997
A85: 1988 XT1-008.FIT | B85: 38362 | D85: 26 | E85: 1988 XT1' | F85: 5.21556 | G85: 46.46611 | H85: 5.2101499999999996 | I85: 46.466140000000003
A86: 1991 BP2-004.FIT | B86: 38362 | D86: 26 | E86: 1991 BP2' | F86: 5.10778 | G86: 43.282780000000002 | H86: 5.1020300000000001 | I86: 43.289749999999998
A87: 1991 BP2-008.FIT | B87: 38362 | D87: 26 | E87: 1991 BP2' | F87: 5.1063900000000002 | G87: 43.282780000000002 | H87: 5.10046 | I87: 43.291400000000003
A88: 1991 BP2-012.FIT | B88: 38362 | D88: 26 | E88: 1991 BP2' | F88: 5.1066700000000003 | G88: 43.282780000000002 | H88: 5.1014499999999998 | I88: 43.291899999999998
A89: Numerowia3.fits | B89: 38362 | D89: 130 | E89: ' | F89: 0 | G89: 0 | H89: 2.43851 | I89: 31.013750000000002
A90: Numerwia1.fits | B90: 38362 | D90: 130 | E90: ' | F90: 0 | G90: 0 | H90: 2.4390999999999998 | I90: 31.0215
A91: Numerwia2.fits | B91: 38362 | D91: 130 | E91: ' | F91: 0 | G91: 0 | H91: 2.4383499999999998 | I91: 31.003830000000001
A92: 18th Mag1.fits | B92: 38362 | D92: 130 | E92: ' | F92: 0 | G92: 0 | H92: 6.9123000000000001 | I92: 43.293039999999998
A93: 18th Mag2.fits | B93: 38362 | D93: 182 | E93: ' | F93: 0 | G93: 0 | H93: 6.9113699999999998 | I93: 43.291469999999997
A94: 18th Mag4.fits | B94: 38362 | D94: 182 | E94: ' | F94: 0 | G94: 0 | H94: 6.9107000000000003 | I94: 43.290109999999999
A95: RENATE-002.FIT | B95: 38362 | D95: 26 | E95: RENATE' | F95: 8.2711100000000002 | G95: 39.066110000000002 | H95: 8.2661700000000007 | I95: 39.095300000000002
A96: RENATE-003.FIT | B96: 38362 | D96: 26 | E96: RENATE' | F96: 8.2711100000000002 | G96: 39.066110000000002 | H96: 8.2663799999999998 | I96: 39.095210000000002
A97: RENATE.fits | B97: 38362 | D97: 78 | E97: RENATE' | F97: 8.2711100000000002 | G97: 39.066110000000002 | H97: 8.2661700000000007 | I97: 39.095300000000002
A98: STROOBANTIA-002.FIT | B98: 38364 | D98: 26 | E98: STROOBANTIA' | F98: 5.0555599999999998 | G98: 32.816670000000002 | H98: 5.0505000000000004 | I98: 32.820929999999997
A99: STROOBANTIA-004.FIT | B99: 38364 | D99: 26 | E99: STROOBANTIA' | F99: 5.0555599999999998 | G99: 32.816670000000002 | H99: 5.0507600000000004 | I99: 32.823900000000002
A100: STROOBANTIA-006.FIT | B100: 38364 | D100: 26 | E100: STROOBANTIA' | F100: 5.0555599999999998 | G100: 32.8 | H100: 5.0506000000000002 | I100: 32.805199999999999
A101: BUCHAR-002.FIT | B101: 38364 | D101: 26 | E101: BUCHAR' | F101: 4.7644399999999996 | G101: 34.766109999999998 | H101: 4.7593500000000004 | I101: 34.774549999999998
A102: BUCHAR-004.FIT | B102: 38364 | D102: 26 | E102: BUCHAR' | F102: 4.7644399999999996 | G102: 34.766109999999998 | H102: 4.7589899999999998 | I102: 34.75938
A103: BUCHAR-006.FIT | B103: 38364 | D103: 26 | E103: BUCHAR' | F103: 4.7644399999999996 | G103: 34.766109999999998 | H103: 4.7597199999999997 | I103: 34.756419999999999
A104: UNITED NATIONS-002.FIT | B104: 38364 | D104: 26 | E104: UNITED NATIONS' | F104: 3.83778 | G104: 30.49944 | H104: 3.8324600000000002 | I104: 30.487500000000001
A105: UNITED NATIONS-004.FIT | B105: 38364 | D105: 26 | E105: UNITED NATIONS' | F105: 3.83778 | G105: 30.49944 | H105: 3.8329300000000002 | I105: 30.484059999999999
A106: UNITED NATIONS-006.FIT | B106: 38364 | D106: 26 | E106: UNITED NATIONS' | F106: 3.83778 | G106: 30.49944 | H106: 3.8332700000000002 | I106: 30.49315
A107: JoeHarmsC.fits | B107: 38364 | D107: 130 | E107: ' | F107: 0 | G107: 0 | H107: 3.2168299999999999 | I107: 34.792000000000002
A108: JoeCombo.fits | B108: 38364 | D108: 780 | E108: ' | F108: 0 | G108: 0 | H108: 3.2169400000000001 | I108: 34.749459999999999
A109: JoeA.fits | B109: 38364 | D109: 260 | E109: ' | F109: 0 | G109: 0 | H109: 3.2169400000000001 | I109: 34.749459999999999
A110: JoeC.fits | B110: 38364 | D110: 260 | E110: ' | F110: 0 | G110: 0 | H110: 3.2168299999999999 | I110: 34.791930000000001
A111: JoeD.fits | B111: 38364 | D111: 260 | E111: ' | F111: 0 | G111: 0 | H111: 3.2169500000000002 | I111: 34.750129999999999
A112: 2000 AG61a002.fit | B112: 38364 | D112: 26 | E112: ' | F112: 0 | G112: 0 | H112: 6.1242799999999997 | I112: 33.078360000000004
A113: 2000 AG61a006.fit | B113: 38364 | D113: 26 | E113: ' | F113: 0 | G113: 0 | H113: 6.1242000000000001 | I113: 33.076770000000003
A114: 2000 AG61a009.fit | B114: 38364 | D114: 26 | E114: ' | F114: 0 | G114: 0 | H114: 6.1240399999999999 | I114: 33.075760000000002
A115: 2000 AG61b003.fit | B115: 38364 | D115: 26 | E115: ' | F115: 0 | G115: 0 | H115: 6.1231799999999996 | I115: 33.060960000000001
A116: 2000 AG61b005.fit | B116: 38364 | D116: 26 | E116: ' | F116: 0 | G116: 0 | H116: 6.1228300000000004 | I116: 33.060079999999999
A117: 2000 AG61c006.fit | B117: 38364 | D117: 26 | E117: ' | F117: 0 | G117: 0 | H117: 6.1241599999999998 | I117: 32.957509999999999
A118: 2000 AG61c008.fit | B118: 38364 | D118: 26 | E118: ' | F118: 0 | G118: 0 | H118: 6.1239299999999997 | I118: 32.956629999999997
A119: 2000 AG61c.fits | B119: 38364 | D119: 260 | E119: ' | F119: 0 | G119: 0 | H119: 6.1241000000000003 | I119: 32.95729
A120: 2000 AG61a.fits | B120: 38364 | D120: 208 | E120: ' | F120: 0 | G120: 0 | H120: 6.1241399999999997 | I120: 33.076560000000001
A121: 2000 AG61b.fits | B121: 38364 | D121: 260 | E121: ' | F121: 0 | G121: 0 | H121: 6.1231099999999996 | I121: 33.060699999999997
A122: 2000 AG61a004.fit | B122: 38364 | D122: 26 | E122: ' | F122: 0 | G122: 0 | H122: 6.12446 | I122: 33.077509999999997
A123: AG61a.fits | B123: 38364 | D123: 78 | E123: ' | F123: 0 | G123: 0 | H123: 6.1242999999999999 | I123: 33.077849999999998
A124: AG61b.fits | B124: 38364 | D124: 78 | E124: ' | F124: 0 | G124: 0 | H124: 6.1231299999999997 | I124: 33.06156
A125: JoeHarmsA.fits | B125: 38364 | D125: 130 | E125: ' | F125: 0 | G125: 0 | H125: 3.2169500000000002 | I125: 34.750129999999999
A126: JoeHarmsB.fits | B126: 38364 | D126: 130 | E126: ' | F126: 0 | G126: 0 | H126: 3.2165599999999999 | I126: 34.796039999999998
A127: JoeHarmsD.fits | B127: 38364 | D127: 130 | E127: ' | F127: 0 | G127: 0 | H127: 3.21685 | I127: 34.774799999999999
A128: 2000 AG61a001.fit | B128: 38364 | D128: 26 | E128: ' | F128: 0 | G128: 0 | H128: 23.992619999999999 | I128: -0.20516999999999999
A129: 2000 AG61a003.fit | B129: 38364 | D129: 26 | E129: ' | F129: 0 | G129: 0 | H129: 23.992730000000002 | I129: -0.20594000000000001
A130: 2000 AG61b001.fit | B130: 38364 | D130: 26 | E130: ' | F130: 0 | G130: 0 | H130: 23.991129999999998 | I130: 7.6560000000000003E-2
A131: 2000 AG61b002.fit | B131: 38364 | D131: 26 | E131: ' | F131: 0 | G131: 0 | H131: 23.991140000000001 | I131: 7.6130000000000003E-2
A132: 2000 AG61a007.fit | B132: 38364 | D132: 26 | E132: ' | F132: 0 | G132: 0 | H132: 6.1242099999999997 | I132: 33.07647
A133: One.fits | B133: 38364 | D133: 312 | E133: ' | F133: 0 | G133: 0 | H133: 6.1241700000000003 | I133: 33.078650000000003
A134: Two.fits | B134: 38364 | D134: 312 | E134: ' | F134: 0 | G134: 0 | H134: 6.1231400000000002 | I134: 33.06156
A135: 2005 AB-002.FIT | B135: 38395 | C135: 0.8771296296296297 | D135: 25 | E135: 2005 AB' | F135: 9.51 | G135: 25.482780000000002 | H135: 0 | I135: 0
A136: TUNIS-002.FIT | B136: 38395 | C136: 0.88378472222222226 | D136: 25 | E136: TUNIS' | F136: 8.5222200000000008 | G136: 30.616109999999999 | H136: 0 | I136: 0
A137: PIERRETTA-001.FIT | B137: 38395 | C137: 0.88467592592592592 | D137: 25 | E137: PIERRETTA' | F137: 8.52 | G137: 30.2 | H137: 0 | I137: 0
A138: PIERRETTA-002.FIT | B138: 38395 | C138: 0.88553240740740735 | D138: 25 | E138: PIERRETTA' | F138: 8.52 | G138: 30.2 | H138: 0 | I138: 0
A139: 2005 AB-004.FIT | B139: 38395 | C139: 0.89047453703703694 | D139: 25 | E139: 2005 AB' | F139: 9.51 | G139: 25.499169999999999 | H139: 0 | I139: 0
A140: 2005 AB-005.FIT | B140: 38395 | C140: 0.89146990740740739 | D140: 25 | E140: 2005 AB' | F140: 9.51 | G140: 25.49944 | H140: 0 | I140: 0
A141: TUNIS-003.FIT | B141: 38395 | C141: 0.89820601851851845 | D141: 25 | E141: TUNIS' | F141: 8.5222200000000008 | G141: 30.616109999999999 | H141: 0 | I141: 0
A142: PIERRETTA-003.FIT | B142: 38395 | C142: 0.89994212962962961 | D142: 25 | E142: PIERRETTA' | F142: 8.52 | G142: 30.2 | H142: 0 | I142: 0
A143: PIERRETTA-004.FIT | B143: 38395 | C143: 0.90078703703703711 | D143: 25 | E143: PIERRETTA' | F143: 8.52 | G143: 30.2 | H143: 0 | I143: 0
A144: 2005 AB-007.FIT | B144: 38395 | C144: 0.90471064814814817 | D144: 25 | E144: 2005 AB' | F144: 9.51 | G144: 25.49944 | H144: 0 | I144: 0
A145: 2005 AB-008.FIT | B145: 38395 | C145: 0.90571759259259255 | D145: 25 | E145: 2005 AB' | F145: 9.51 | G145: 25.49944 | H145: 0 | I145: 0
A146: TUNIS-005.FIT | B146: 38395 | C146: 0.91136574074074073 | D146: 25 | E146: TUNIS' | F146: 8.5222200000000008 | G146: 30.616109999999999 | H146: 0 | I146: 0
A147: PIERRETTA-005.FIT | B147: 38395 | C147: 0.91310185185185189 | D147: 25 | E147: PIERRETTA' | F147: 8.5188900000000007 | G147: 30.2 | H147: 0 | I147: 0
A148: TUNIS-001.FIT | B148: 38395 | D148: 25 | E148: TUNIS' | F148: 8.5222200000000008 | G148: 30.616109999999999 | H148: 8.5155999999999992 | I148: 30.622509999999998
A149: TUNIS-004.FIT | B149: 38395 | D149: 25 | E149: TUNIS' | F149: 8.5222200000000008 | G149: 30.616109999999999 | H149: 8.5172799999999995 | I149: 30.646039999999999
A150: TUNIS-006.FIT | B150: 38395 | D150: 25 | E150: TUNIS' | F150: 8.5222200000000008 | G150: 30.616109999999999 | H150: 8.51694 | I150: 30.638120000000001
A151: PIERRETTA-006.FIT | B151: 38395 | C151: 0.91394675925925928 | D151: 25 | E151: PIERRETTA' | F151: 8.5188900000000007 | G151: 30.2 | H151: 0 | I151: 0
A152: 2005 AB-003.FIT | B152: 38395 | D152: 25 | E152: 2005 AB' | F152: 9.51 | G152: 25.482780000000002 | H152: 9.5062899999999999 | I152: 25.516919999999999
A153: 2005 AB-006.FIT | B153: 38395 | D153: 25 | E153: 2005 AB' | F153: 9.51 | G153: 25.49944 | H153: 9.5054800000000004 | I153: 25.530380000000001
A154: 2005 AB-009.FIT | B154: 38395 | D154: 25 | E154: 2005 AB' | F154: 9.51 | G154: 25.49944 | H154: 9.5053900000000002 | I154: 25.523150000000001
A155: RENAUXA-002.FIT | B155: 38398 | D155: 26 | E155: RENAUXA' | F155: 7.76 | G155: 32.33278 | H155: 7.7551600000000001 | I155: 32.348799999999997
A156: RENAUXA-011.FIT | B156: 38398 | D156: 26 | E156: RENAUXA' | F156: 7.7588900000000001 | G156: 32.333060000000003 | H156: 7.7529500000000002 | I156: 32.339379999999998
A157: PHILLIPADAMS-002.FIT | B157: 38398 | D157: 26 | E157: PHILLIPADAMS' | F157: 7.7144399999999997 | G157: 31.616669999999999 | H157: 7.7096600000000004 | I157: 31.64358
A158: PHILLIPADAMS-004.FIT | B158: 38398 | D158: 26 | E158: PHILLIPADAMS' | F158: 7.71333 | G158: 31.616669999999999 | H158: 7.7086699999999997 | I158: 31.64406
A159: PHILLIPADAMS-005.FIT | B159: 38398 | D159: 26 | E159: PHILLIPADAMS' | F159: 7.71333 | G159: 31.616669999999999 | H159: 7.7089400000000001 | I159: 31.645890000000001
A160: RENAUXA-012.FIT | B160: 38398 | D160: 26 | E160: RENAUXA' | F160: 7.75861 | G160: 32.33278 | H160: 7.7543300000000004 | I160: 32.356169999999999
A161: RENAUXA-005.FIT | B161: 38398 | D161: 26 | E161: RENAUXA' | F161: 7.76 | G161: 32.33278 | H161: 7.7549799999999998 | I161: 32.354700000000001
A162: RENAUXA-007.FIT | B162: 38398 | D162: 26 | E162: RENAUXA' | F162: 7.76 | G162: 32.33278 | H162: 7.7553900000000002 | I162: 32.359850000000002
A163: EUBOEA-002.FIT | B163: 38398 | D163: 26 | E163: EUBOEA' | F163: 7.6541699999999997 | G163: 31.6 | H163: 7.6496300000000002 | I163: 31.62388
A164: EUBOEA-004.FIT | B164: 38398 | D164: 26 | E164: EUBOEA' | F164: 7.6533300000000004 | G164: 31.6 | H164: 7.64872 | I164: 31.624269999999999
A165: EUBOEA-005.FIT | B165: 38398 | D165: 26 | E165: EUBOEA' | F165: 7.6533300000000004 | G165: 31.599440000000001 | H165: 7.6477199999999996 | I165: 31.612629999999999
A166: 2005 AB-002.FIT | B166: 38398 | D166: 26 | E166: 2005 AB' | F166: 9.5677800000000008 | G166: 27.38278 | H166: 9.5635700000000003 | I166: 27.410620000000002
A167: 2005 AB-006.FIT | B167: 38398 | D167: 26 | E167: 2005 AB' | F167: 9.5688899999999997 | G167: 27.399719999999999 | H167: 9.5642700000000005 | I167: 27.429770000000001
A168: 2005 AB-009.FIT | B168: 38398 | D168: 26 | E168: 2005 AB' | F168: 9.5688899999999997 | G168: 27.41611 | H168: 9.5646500000000003 | I168: 27.45138
A169: 2005 AB-005.FIT | B169: 38402 | D169: 26 | E169: 2005 AB' | F169: 9.6669400000000003 | G169: 30.16639 | H169: 9.6626100000000008 | I169: 30.201799999999999
A170: 2005 AB-009.FIT | B170: 38402 | D170: 26 | E170: 2005 AB' | F170: 9.6677800000000005 | G170: 30.15 | H170: 9.6632400000000001 | I170: 30.188230000000001
A171: 2005 AB-016.FIT | B171: 38402 | D171: 26 | E171: 2005 AB' | F171: 9.6669400000000003 | G171: 30.2 | H171: 9.6631199999999993 | I171: 30.21998
A172: 2005 AB-003.FIT | B172: 38417 | D172: 26 | E172: 2005 AB' | F172: 10.34 | G172: 41.699440000000003 | H172: 10.334009999999999 | I172: 41.722169999999998
A173: 2005 AB-004.FIT | B173: 38417 | D173: 26 | E173: 2005 AB' | F173: 10.342219999999999 | G173: 41.71611 | H173: 10.33487 | I173: 41.745669999999997
A174: Rusthawelia-008.FIT | B174: 38417 | D174: 26 | E174: 2005 AB' | F174: 10.34333 | G174: 41.732779999999998 | H174: 10.334099999999999 | I174: 41.768430000000002
A175: Rust A.fit | B175: 38417 | C175: 0.84991898148148148 | D175: 26 | E175: ' | F175: 9.1425000000000001 | G175: 18.066389999999998 | H175: 0 | I175: 0
A176: Rust B.fit | B176: 38417 | C176: 0.87364583333333334 | D176: 26 | E176: ' | F176: 9.1444399999999995 | G176: 18.066389999999998 | H176: 0 | I176: 0
A177: Rust C.fit | B177: 38417 | C177: 0.89851851851851849 | D177: 26 | E177: ' | F177: 9.1444399999999995 | G177: 18.066389999999998 | H177: 0 | I177: 0
A178: EMIKO-002.FIT | B178: 38417 | D178: 26 | E178: EMIKO' | F178: 9.59 | G178: 32.516669999999998 | H178: 9.5855800000000002 | I178: 32.541150000000002
A179: EMIKO-004.FIT | B179: 38417 | D179: 26 | E179: EMIKO' | F179: 9.5888899999999992 | G179: 32.516669999999998 | H179: 9.5824599999999993 | I179: 32.545189999999998
A180: EMIKO-009.FIT | B180: 38417 | D180: 26 | E180: EMIKO' | F180: 9.5888899999999992 | G180: 32.516669999999998 | H180: 9.5841700000000003 | I180: 32.548099999999998
A181: SILVRETTA-002.FIT | B181: 38417 | D181: 26 | E181: SILVRETTA' | F181: 9.46 | G181: 36.349440000000001 | H181: 9.4544300000000003 | I181: 36.384340000000002
A182: SILVRETTA-004.FIT | B182: 38417 | D182: 26 | E182: SILVRETTA' | F182: 9.46 | G182: 36.349440000000001 | H182: 9.4549800000000008 | I182: 36.387219999999999
A183: SILVRETTA-005.FIT | B183: 38417 | D183: 26 | E183: SILVRETTA' | F183: 9.4591700000000003 | G183: 36.349440000000001 | H183: 9.4529899999999998 | I183: 36.375010000000003
A184: 1998 KU48-002.FIT | B184: 38417 | D184: 26 | E184: 1998 KU48' | F184: 9.06 | G184: 31.41611 | H184: 9.0559200000000004 | I184: 31.443619999999999
A185: 1998 KU48-004.FIT | B185: 38417 | D185: 26 | E185: 1998 KU48' | F185: 9.06 | G185: 31.41611 | H185: 9.0553899999999992 | I185: 31.444659999999999
A186: 1998 KU48-007.FIT | B186: 38417 | D186: 26 | E186: 1998 KU48' | F186: 9.06 | G186: 31.41611 | H186: 9.0552899999999994 | I186: 31.429780000000001
A187: Rusthawelia A.fit | B187: 38417 | D187: 26 | E187: ' | F187: 9.1425000000000001 | G187: 18.066389999999998 | H187: 9.1385100000000001 | I187: 18.095479999999998
A188: Rusthawelia B.fit | B188: 38417 | D188: 26 | E188: ' | F188: 9.1444399999999995 | G188: 18.066389999999998 | H188: 9.1399699999999999 | I188: 18.100770000000001
A189: Rusthawelia C.fit | B189: 38417 | D189: 26 | E189: ' | F189: 9.1444399999999995 | G189: 18.066389999999998 | H189: 9.1401400000000006 | I189: 18.099039999999999
A190: VERBAANDERT-001.FIT | B190: 38444 | D190: 26 | E190: VERBAANDERT' | F190: 10.123329999999999 | G190: 28.549440000000001 | H190: 10.11895 | I190: 28.579840000000001
A191: VERBAANDERT-011.FIT | B191: 38444 | D191: 26 | E191: VERBAANDERT' | F191: 10.123329999999999 | G191: 28.549440000000001 | H191: 10.11956 | I191: 28.57639
A192: VERBAANDERT-012.FIT | B192: 38444 | D192: 26 | E192: VERBAANDERT' | F192: 10.12444 | G192: 28.549440000000001 | H192: 10.11965 | I192: 28.57612
A193: VERBAANDERT-021.FIT | B193: 38444 | D193: 26 | E193: VERBAANDERT' | F193: 10.125 | G193: 28.533329999999999 | H193: 10.11988 | I193: 28.564050000000002
A194: VERBAANDERT-022.FIT | B194: 38444 | D194: 26 | E194: VERBAANDERT' | F194: 10.12444 | G194: 28.533329999999999 | H194: 10.120100000000001 | I194: 28.563849999999999
A195: VERBAANDERTb.fits | B195: 38444 | D195: 208 | E195: VERBAANDERT' | F195: 10.123329999999999 | G195: 28.549440000000001 | H195: 10.11956 | I195: 28.576350000000001
A196: VERBAANDERTc.fits | B196: 38444 | D196: 234 | E196: VERBAANDERT' | F196: 10.125 | G196: 28.533329999999999 | H196: 10.11988 | I196: 28.564139999999998
A197: 2000 JR16-002.FIT | B197: 38444 | D197: 26 | E197: 2000 JR16' | F197: 13.72556 | G197: 32.399720000000002 | H197: 13.724780000000001 | I197: 32.526850000000003
A198: 2000 JR16-001.FIT | B198: 38444 | D198: 26 | E198: 2000 JR16' | F198: 13.72556 | G198: 32.399720000000002 | H198: 13.724550000000001 | I198: 32.527830000000002
A199: VERBAANDERT-005.FIT | B199: 38444 | D199: 26 | E199: VERBAANDERT' | F199: 10.12444 | G199: 28.549440000000001 | H199: 10.11931 | I199: 28.576879999999999
A200: VERBAANDERT-002.FIT | B200: 38444 | D200: 26 | E200: VERBAANDERT' | F200: 10.123329999999999 | G200: 28.549440000000001 | H200: 10.11894 | I200: 28.578620000000001
A201: VERBAANDERT-004.FIT | B201: 38444 | D201: 26 | E201: VERBAANDERT' | F201: 10.123329999999999 | G201: 28.549440000000001 | H201: 10.119289999999999 | I201: 28.57734
A202: VERBAANDERTa.fits | B202: 38444 | D202: 104 | E202: VERBAANDERT' | F202: 10.123329999999999 | G202: 28.549440000000001 | H202: 10.11909 | I202: 28.57771
A203: 2000 JR16-004.FIT | B203: 38444 | D203: 26 | E203: 2000 JR16' | F203: 13.72583 | G203: 32.399720000000002 | H203: 13.724729999999999 | I203: 32.526910000000001
A204: 2000 JR16-005.FIT | B204: 38444 | D204: 26 | E204: 2000 JR16' | F204: 13.72583 | G204: 32.399720000000002 | H204: 13.72476 | I204: 32.526049999999998
A205: VERBAANDERT-003.FIT | B205: 38444 | D205: 26 | E205: VERBAANDERT' | F205: 10.123329999999999 | G205: 28.549440000000001 | H205: 10.11909 | I205: 28.57771
A206: VERBAANDERT-014.FIT | B206: 38444 | D206: 26 | E206: VERBAANDERT' | F206: 10.12444 | G206: 28.549440000000001 | H206: 10.11971 | I206: 28.575150000000001
A207: VERBAANDERT-029.FIT | B207: 38444 | D207: 26 | E207: VERBAANDERT' | F207: 10.12444 | G207: 28.533329999999999 | H207: 10.11974 | I207: 28.560390000000002
A208: 1999 RR28-020.FIT | B208: 38446 | D208: 26 | E208: 1999 RR28' | F208: 10.633330000000001 | G208: 29.116109999999999 | H208: 10.629379999999999 | I208: 29.15155
A209: AMAZONE-001.FIT | B209: 38446 | D209: 26 | E209: AMAZONE' | F209: 10.978059999999999 | G209: 33.566389999999998 | H209: 10.97321 | I209: 33.60322
A210: AMAZONE-002.FIT | B210: 38446 | D210: 26 | E210: AMAZONE' | F210: 10.97833 | G210: 33.566389999999998 | H210: 10.97307 | I210: 33.603090000000002
A211: AMAZONE-011.FIT | B211: 38446 | D211: 26 | E211: AMAZONE' | F211: 10.977779999999999 | G211: 33.566389999999998 | H211: 10.97315 | I211: 33.60783
A212: AMAZONE-021.FIT | B212: 38446 | D212: 26 | E212: AMAZONE' | F212: 10.977779999999999 | G212: 33.566389999999998 | H212: 10.9727 | I212: 33.61018
A213: AMAZONE-022.FIT | B213: 38446 | D213: 26 | E213: AMAZONE' | F213: 10.977779999999999 | G213: 33.566389999999998 | H213: 10.97242 | I213: 33.609529999999999
A214: AMAZONE-012.FIT | B214: 38446 | D214: 26 | E214: AMAZONE' | F214: 10.977779999999999 | G214: 33.566389999999998 | H214: 10.972939999999999 | I214: 33.607559999999999
A215: AMAZONE-013.FIT | B215: 38446 | D215: 26 | E215: AMAZONE' | F215: 10.977779999999999 | G215: 33.566389999999998 | H215: 10.97312 | I215: 33.60727
A216: 1999 RR28-014.FIT | B216: 38446 | D216: 26 | E216: 1999 RR28' | F216: 10.633330000000001 | G216: 29.116109999999999 | H216: 10.629250000000001 | I216: 29.15447
A217: 1999 RR28-015.FIT | B217: 38446 | D217: 26 | E217: 1999 RR28' | F217: 10.633330000000001 | G217: 29.116109999999999 | H217: 10.62932 | I217: 29.15419
A218: 1999 RR28-011.FIT | B218: 38446 | D218: 26 | E218: 1999 RR28' | F218: 10.63444 | G218: 29.13278 | H218: 10.62904 | I218: 29.156369999999999
A219: 1999 RR28-012.FIT | B219: 38446 | D219: 26 | E219: 1999 RR28' | F219: 10.633330000000001 | G219: 29.116109999999999 | H219: 10.62932 | I219: 29.155919999999998
A220: 1999 RR28.fits | B220: 38446 | D220: 260 | E220: 1999 RR28' | F220: 10.63444 | G220: 29.13278 | H220: 10.62904 | I220: 29.156369999999999
A221: AMAZONE-015.FIT | B221: 38446 | D221: 26 | E221: AMAZONE' | F221: 10.977779999999999 | G221: 33.566389999999998 | H221: 10.97339 | I221: 33.606319999999997
A222: AMAZONE-016.FIT | B222: 38446 | D222: 26 | E222: AMAZONE' | F222: 10.977779999999999 | G222: 33.566389999999998 | H222: 10.973319999999999 | I222: 33.606119999999997
A223: AMAZONE-017.FIT | B223: 38446 | D223: 26 | E223: AMAZONE' | F223: 10.977779999999999 | G223: 33.566389999999998 | H223: 10.9734 | I223: 33.605670000000003
A224: 1999 RR28-022.FIT | B224: 38446 | D224: 26 | E224: 1999 RR28' | F224: 10.64 | G224: 29.08278 | H224: 10.63542 | I224: 29.110420000000001
A225: 1999 RR28-025.FIT | B225: 38446 | D225: 26 | E225: 1999 RR28' | F225: 10.64 | G225: 29.08278 | H225: 10.63564 | I225: 29.123419999999999
A226: 1999 RR28-030.FIT | B226: 38446 | D226: 26 | E226: 1999 RR28' | F226: 10.64222 | G226: 29.066389999999998 | H226: 10.63805 | I226: 29.09808
A227: AMAZONEa.fits | B227: 38446 | D227: 234 | E227: AMAZONE' | F227: 10.978059999999999 | G227: 33.566389999999998 | H227: 10.9732 | I227: 33.603180000000002
A228: AMAZONEb.fits | B228: 38446 | D228: 130 | E228: AMAZONE' | F228: 10.977779999999999 | G228: 33.566389999999998 | H228: 10.973319999999999 | I228: 33.606009999999998
A229: AMAZONEc.fits | B229: 38446 | D229: 260 | E229: AMAZONE' | F229: 10.977779999999999 | G229: 33.566389999999998 | H229: 10.972659999999999 | I229: 33.610140000000001
A230: PER BRAHE-003.FIT | B230: 38452 | D230: 26 | E230: PER BRAHE' | F230: 10.38889 | G230: 16.66639 | H230: 10.384130000000001 | I230: 16.695229999999999
A231: PER BRAHE-005.FIT | B231: 38452 | D231: 26 | E231: PER BRAHE' | F231: 10.38889 | G231: 16.66639 | H231: 10.384840000000001 | I231: 16.69603
A232: PER BRAHE-008.FIT | B232: 38452 | D232: 26 | E232: PER BRAHE' | F232: 10.38889 | G232: 16.66639 | H232: 10.38438 | I232: 16.692519999999998
A233: MILET-006.FIT | B233: 38452 | D233: 26 | E233: MILET' | F233: 10.71444 | G233: 14.466390000000001 | H233: 10.71069 | I233: 14.507059999999999
A234: MILET-013.FIT | B234: 38452 | D234: 26 | E234: MILET' | F234: 10.71444 | G234: 14.48278 | H234: 10.710240000000001 | I234: 14.522360000000001
A235: MILET-022.FIT | B235: 38452 | D235: 26 | E235: MILET' | F235: 10.71444 | G235: 14.48278 | H235: 10.710459999999999 | I235: 14.51972
A236: AMICITIA-003.FIT | B236: 38452 | D236: 26 | E236: AMICITIA' | F236: 10.90222 | G236: 12.46611 | H236: 10.89851 | I236: 12.49893
A237: AMICITIA-020.FIT | B237: 38452 | D237: 26 | E237: AMICITIA' | F237: 10.90333 | G237: 12.46611 | H237: 10.898960000000001 | I237: 12.49436
A238: AMICITIA-001.FIT | B238: 38452 | D238: 26 | E238: AMICITIA' | F238: 10.90333 | G238: 12.46611 | H238: 10.899620000000001 | I238: 12.51735
A239: AMICITIA-002.FIT | B239: 38452 | D239: 26 | E239: AMICITIA' | F239: 10.90333 | G239: 12.46611 | H239: 10.89846 | I239: 12.49919
A240: AMICITIA-008.FIT | B240: 38452 | D240: 26 | E240: AMICITIA' | F240: 10.90333 | G240: 12.46611 | H240: 10.89972 | I240: 12.51688
A241: AMICITIA-009.FIT | B241: 38452 | D241: 26 | E241: AMICITIA' | F241: 10.90333 | G241: 12.46611 | H241: 10.898999999999999 | I241: 12.49845
A242: AMICITIA-015.FIT | B242: 38452 | D242: 26 | E242: AMICITIA' | F242: 10.90333 | G242: 12.46611 | H242: 10.899889999999999 | I242: 12.514760000000001
A243: AMICITIA-016.FIT | B243: 38452 | D243: 26 | E243: AMICITIA' | F243: 10.90333 | G243: 12.46611 | H243: 10.898870000000001 | I243: 12.496219999999999
A244: MILET-001.FIT | B244: 38452 | D244: 26 | E244: MILET' | F244: 10.71444 | G244: 14.48306 | H244: 10.709669999999999 | I244: 14.52679
A245: MILET-002.FIT | B245: 38452 | D245: 26 | E245: MILET' | F245: 10.714169999999999 | G245: 14.48278 | H245: 10.71006 | I245: 14.508979999999999
A246: MILET-010.FIT | B246: 38452 | D246: 26 | E246: MILET' | F246: 10.71444 | G246: 14.48278 | H246: 10.711399999999999 | I246: 14.524330000000001
A247: MILET-011.FIT | B247: 38452 | D247: 26 | E247: MILET' | F247: 10.71444 | G247: 14.48278 | H247: 10.710430000000001 | I247: 14.52336
A248: MILET-019.FIT | B248: 38452 | D248: 26 | E248: MILET' | F248: 10.71444 | G248: 14.48278 | H248: 10.710330000000001 | I248: 14.52103
A249: MILET-020.FIT | B249: 38452 | D249: 26 | E249: MILET' | F249: 10.71444 | G249: 14.48278 | H249: 10.71027 | I249: 14.52051
A250: EGERIA-014.FIT | B250: 38458 | D250: 26 | E250: EGERIA' | F250: 11.36556 | G250: 23.099440000000001 | H250: 11.36115 | I250: 23.14049
A251: Gaby-006.fit | B251: 38458 | D251: 26 | E251: GABY' | F251: 10.998889999999999 | G251: 24.33278 | H251: 10.9947 | I251: 24.37209
A252: Gaby-009.fit | B252: 38458 | D252: 26 | E252: GABY' | F252: 11.001110000000001 | G252: 24.316109999999998 | H252: 10.99672 | I252: 24.354759999999999
A253: LEHIGH-004.FIT | B253: 38458 | D253: 26 | E253: LEHIGH' | F253: 11.29 | G253: 22.982780000000002 | H253: 11.28589 | I253: 23.020209999999999
A254: LEHIGH-015.FIT | B254: 38458 | D254: 26 | E254: LEHIGH' | F254: 11.29 | G254: 22.982780000000002 | H254: 11.286149999999999 | I254: 23.016549999999999
A255: EGERIA-001.FIT | B255: 38458 | D255: 26 | E255: EGERIA' | F255: 11.36556 | G255: 23.13278 | H255: 11.361700000000001 | I255: 23.157080000000001
A256: EGERIA-003.FIT | B256: 38458 | D256: 26 | E256: EGERIA' | F256: 11.366669999999999 | G256: 23.116109999999999 | H256: 11.36205 | I256: 23.156490000000002
A257: EGERIA-007.FIT | B257: 38458 | D257: 26 | E257: EGERIA' | F257: 11.36556 | G257: 23.116109999999999 | H257: 11.361230000000001 | I257: 23.142849999999999
A258: EGERIA-008.FIT | B258: 38458 | D258: 26 | E258: EGERIA' | F258: 11.36556 | G258: 23.116109999999999 | H258: 11.361039999999999 | I258: 23.142779999999998
A259: Gaby-001.fit | B259: 38458 | D259: 26 | E259: GABY' | F259: 11 | G259: 24.33333 | H259: 10.99447 | I259: 24.37406
A260: Gaby-003.fit | B260: 38458 | D260: 26 | E260: GABY' | F260: 10.998889999999999 | G260: 24.33278 | H260: 10.99466 | I260: 24.373059999999999
A261: Gaby-007.fit | B261: 38458 | D261: 26 | E261: GABY' | F261: 11 | G261: 24.316109999999998 | H261: 10.99635 | I261: 24.35586
A262: Gaby-008.fit | B262: 38458 | D262: 26 | E262: GABY' | F262: 11.001110000000001 | G262: 24.316109999999998 | H262: 10.996600000000001 | I262: 24.355709999999998
A263: Gaby-013.fit | B263: 38458 | D263: 26 | E263: GABY' | F263: 11 | G263: 24.316109999999998 | H263: 10.99553 | I263: 24.353660000000001
A264: Gaby-014.fit | B264: 38458 | D264: 26 | E264: GABY' | F264: 11 | G264: 24.316109999999998 | H264: 10.99545 | I264: 24.353000000000002
A265: JIANGXI-007.FIT | B265: 38458 | D265: 26 | E265: JIANGXI' | F265: 11.415559999999999 | G265: 21.74944 | H265: 11.411899999999999 | I265: 21.785830000000001
A266: JIANGXI-009.FIT | B266: 38458 | D266: 26 | E266: JIANGXI' | F266: 11.41667 | G266: 21.74944 | H266: 11.41161 | I266: 21.784949999999998
A267: JIANGXI-013.FIT | B267: 38458 | D267: 26 | E267: JIANGXI' | F267: 11.414440000000001 | G267: 21.74944 | H267: 11.41137 | I267: 21.806010000000001
A268: JIANGXI-014.FIT | B268: 38458 | D268: 26 | E268: JIANGXI' | F268: 11.415559999999999 | G268: 21.766110000000001 | H268: 11.41126 | I268: 21.80547
A269: JIANGXI-019.FIT | B269: 38458 | D269: 26 | E269: JIANGXI' | F269: 11.414440000000001 | G269: 21.74944 | H269: 11.41025 | I269: 21.805330000000001
A270: JIANGXI-020.FIT | B270: 38458 | D270: 26 | E270: JIANGXI' | F270: 11.414440000000001 | G270: 21.766110000000001 | H270: 11.41038 | I270: 21.804929999999999
A271: LEHIGH-001.FIT | B271: 38458 | D271: 26 | E271: LEHIGH' | F271: 11.29 | G271: 22.983329999999999 | H271: 11.285600000000001 | I271: 23.021239999999999
A272: LEHIGH-002.FIT | B272: 38458 | D272: 26 | E272: LEHIGH' | F272: 11.29 | G272: 22.982780000000002 | H272: 11.28562 | I272: 23.020710000000001
A273: LEHIGH-007.FIT | B273: 38458 | D273: 26 | E273: LEHIGH' | F273: 11.29 | G273: 22.983329999999999 | H273: 11.28534 | I273: 23.019960000000001
A274: LEHIGH-008.FIT | B274: 38458 | D274: 26 | E274: LEHIGH' | F274: 11.29 | G274: 22.982780000000002 | H274: 11.285539999999999 | I274: 23.019960000000001
A275: LEHIGH-013.FIT | B275: 38458 | D275: 26 | E275: LEHIGH' | F275: 11.29 | G275: 22.983329999999999 | H275: 11.28618 | I275: 23.017959999999999
A276: LEHIGH-014.FIT | B276: 38458 | D276: 26 | E276: LEHIGH' | F276: 11.29 | G276: 22.982780000000002 | H276: 11.286210000000001 | I276: 23.01689
A277: RACHELE-001.FIT | B277: 38458 | D277: 26 | E277: RACHELE' | F277: 11.16778 | G277: 23.732780000000002 | H277: 11.163209999999999 | I277: 23.758279999999999
A278: RACHELE-002.FIT | B278: 38458 | D278: 26 | E278: RACHELE' | F278: 11.16778 | G278: 23.732780000000002 | H278: 11.163360000000001 | I278: 23.757760000000001
A279: RACHELE-007.FIT | B279: 38458 | D279: 26 | E279: RACHELE' | F279: 11.16778 | G279: 23.732780000000002 | H279: 11.16297 | I279: 23.757020000000001
A280: RACHELE-008.FIT | B280: 38458 | D280: 26 | E280: RACHELE' | F280: 11.16778 | G280: 23.71611 | H280: 11.162979999999999 | I280: 23.756489999999999
A281: RACHELE-013.FIT | B281: 38458 | D281: 26 | E281: RACHELE' | F281: 11.16778 | G281: 23.732780000000002 | H281: 11.16329 | I281: 23.75149
A282: RACHELE-014.FIT | B282: 38458 | D282: 26 | E282: RACHELE' | F282: 11.16778 | G282: 23.71611 | H282: 11.1633 | I282: 23.751290000000001
A283: ALFATERNC.fit | B283: 38458 | D283: 130 | E283: ALFATERNA' | F283: 11.35444 | G283: 23.49944 | H283: 11.350110000000001 | I283: 23.531970000000001
A284: GabyA.fits | B284: 38458 | D284: 78 | E284: GABY' | F284: 11 | G284: 24.33333 | H284: 10.99447 | I284: 24.37396
A285: GabyB.fits | B285: 38458 | D285: 130 | E285: GABY' | F285: 11 | G285: 24.316109999999998 | H285: 10.99635 | I285: 24.355689999999999
A286: GabyC.fits | B286: 38458 | D286: 104 | E286: GABY' | F286: 11 | G286: 24.316109999999998 | H286: 10.99553 | I286: 24.353560000000002
A287: JiangxiA.fits | B287: 38458 | D287: 104 | E287: JIANGXI' | F287: 11.415559999999999 | G287: 21.74944 | H287: 11.41189 | I287: 21.785779999999999
A288: JIANGXIB.fits | B288: 38458 | D288: 130 | E288: JIANGXI' | F288: 11.414440000000001 | G288: 21.74944 | H288: 11.41137 | I288: 21.805969999999999
A289: JIANGXIC.fits | B289: 38458 | D289: 156 | E289: JIANGXI' | F289: 11.414440000000001 | G289: 21.74944 | H289: 11.41024 | I289: 21.805250000000001
A290: RACHELEA.fits | B290: 38458 | D290: 104 | E290: RACHELE' | F290: 11.16778 | G290: 23.732780000000002 | H290: 11.1632 | I290: 23.758120000000002
A291: RACHELEB.fits | B291: 38458 | D291: 104 | E291: RACHELE' | F291: 11.16778 | G291: 23.732780000000002 | H291: 11.16297 | I291: 23.756889999999999
A292: RACHELEC.fits | B292: 38458 | D292: 130 | E292: RACHELE' | F292: 11.16778 | G292: 23.732780000000002 | H292: 11.16328 | I292: 23.751390000000001
A293: ALFATERNAA.fits | B293: 38458 | D293: 130 | E293: ALFATERNA' | F293: 11.35444 | G293: 23.49944 | H293: 11.34975 | I293: 23.536760000000001
A294: ALFATERNAB.fits | B294: 38458 | D294: 156 | E294: ALFATERNA' | F294: 11.35444 | G294: 23.49944 | H294: 11.349869999999999 | I294: 23.5383
A295: ALFATERNC.fits | B295: 38458 | D295: 130 | E295: ALFATERNA' | F295: 11.35444 | G295: 23.49944 | H295: 11.350110000000001 | I295: 23.53201
A296: LEHIGHA.fits | B296: 38458 | D296: 156 | E296: LEHIGH' | F296: 11.29 | G296: 22.983329999999999 | H296: 11.285589999999999 | I296: 23.021190000000001
A297: LEHIGHB.fits | B297: 38458 | D297: 156 | E297: LEHIGH' | F297: 11.29 | G297: 22.983329999999999 | H297: 11.28533 | I297: 23.0199
A298: LEHIGHC.fits | B298: 38458 | D298: 156 | E298: LEHIGH' | F298: 11.29 | G298: 22.983329999999999 | H298: 11.28617 | I298: 23.017910000000001
A299: ALFATERNA-001.FIT | B299: 38458 | D299: 26 | E299: ALFATERNA' | F299: 11.35444 | G299: 23.49944 | H299: 11.34976 | I299: 23.536719999999999
A300: ALFATERNA-003.FIT | B300: 38458 | D300: 26 | E300: ALFATERNA' | F300: 11.35444 | G300: 23.49944 | H300: 11.35017 | I300: 23.536380000000001
A301: ALFATERNA-007.FIT | B301: 38458 | D301: 26 | E301: ALFATERNA' | F301: 11.35444 | G301: 23.49944 | H301: 11.349880000000001 | I301: 23.538270000000001
A302: ALFATERNA-008.FIT | B302: 38458 | D302: 26 | E302: ALFATERNA' | F302: 11.35444 | G302: 23.49944 | H302: 11.350070000000001 | I302: 23.5379
A303: ALFATERNA-013.FIT | B303: 38458 | D303: 26 | E303: ALFATERNA' | F303: 11.35444 | G303: 23.49944 | H303: 11.350110000000001 | I303: 23.531970000000001
A304: ALFATERNA-014.FIT | B304: 38458 | D304: 26 | E304: ALFATERNA' | F304: 11.35444 | G304: 23.49944 | H304: 11.3499 | I304: 23.53162
A305: ALFATERNA1.fits | B305: 38458 | D305: 130 | E305: ALFATERNA' | F305: 11.35444 | G305: 23.49944 | H305: 11.34976 | I305: 23.536719999999999
A306: ALFATERNA2.fits | B306: 38458 | D306: 156 | E306: ALFATERNA' | F306: 11.35444 | G306: 23.49944 | H306: 11.349880000000001 | I306: 23.538270000000001
A307: ALFATERNA3.fits | B307: 38458 | D307: 130 | E307: ALFATERNA' | F307: 11.35444 | G307: 23.49944 | H307: 11.350110000000001 | I307: 23.531970000000001
A308: Akirafujii 1.fits | B308: 38460 | D308: 78 | E308: AKIRAFUJII' | F308: 11.95444 | G308: 24.032779999999999 | H308: 11.951320000000001 | I308: 24.082049999999999
A309: AKIRAFUJII-003.FIT | B309: 38460 | D309: 26 | E309: AKIRAFUJII' | F309: 11.95472 | G309: 24.032779999999999 | H309: 11.94999 | I309: 24.084240000000001
A310: JEAN-JACQUES-002.FIT | B310: 38460 | D310: 26 | E310: JEAN-JACQUES' | F310: 11.97 | G310: 22.399719999999999 | H310: 11.96625 | I310: 22.43854
A311: JEAN-JACQUES-009.FIT | B311: 38460 | D311: 26 | E311: JEAN-JACQUES' | F311: 11.969720000000001 | G311: 22.399719999999999 | H311: 11.9658 | I311: 22.44023
A312: 2000 AZ113-001.FIT | B312: 38473 | D312: 26 | E312: 2000 AZ113' | F312: 12.19778 | G312: 19.399439999999998 | H312: 12.193849999999999 | I312: 19.43948
A313: 2001 BG51-001.FIT | B313: 38479 | D313: 26 | E313: 2001 BG51' | F313: 16.564440000000001 | G313: 25.83278 | H313: 16.560860000000002 | I313: 25.84779
A314: EDITHLEVY-015.FIT | B314: 38479 | D314: 26 | E314: EDITHLEVY' | F314: 16.387779999999999 | G314: 26.049440000000001 | H314: 16.38467 | I314: 26.068370000000002
A315: 2001 BG51-001.FIT | B315: 38480 | D315: 26 | E315: 2001 BG51' | F315: 16.553329999999999 | G315: 25.949439999999999 | H315: 16.54964 | I315: 25.968920000000001
A316: 1988 RE-001.FIT | B316: 38480 | D316: 26 | E316: 1988 RE' | F316: 16.47222 | G316: 25.799440000000001 | H316: 16.469460000000002 | I316: 25.817509999999999
A317: EDITHLEVY-C.fits | B317: 38480 | D317: 104 | E317: EDITHLEVY' | F317: 16.371110000000002 | G317: 26.1 | H317: 16.36758 | I317: 26.120809999999999
A318: 1988 RE-A.fits | B318: 38480 | D318: 104 | E318: 1988 RE' | F318: 16.47222 | G318: 25.799440000000001 | H318: 16.469439999999999 | I318: 25.81934
A319: 1991 XE-002.FIT | B319: 38482 | D319: 26 | E319: 1991 XE' | F319: 14.661110000000001 | G319: 19.816109999999998 | H319: 14.657719999999999 | I319: 19.843029999999999
A320: 2001 BG51-001.FIT | B320: 38480 | D320: 26 | E320: 2001 BG51' | F320: 16.553329999999999 | G320: 25.949439999999999 | H320: 16.54964 | I320: 25.968920000000001
A321: 1988 RE-001.FIT | B321: 38480 | D321: 26 | E321: 1988 RE' | F321: 16.47222 | G321: 25.799440000000001 | H321: 16.469460000000002 | I321: 25.817509999999999
A322: EDITHLEVY-C.fits | B322: 38480 | D322: 104 | E322: EDITHLEVY' | F322: 16.371110000000002 | G322: 26.1 | H322: 16.36758 | I322: 26.120809999999999
A323: 2001 CU20-004.FIT | B323: 38482 | D323: 26 | E323: 2001 CU20' | F323: 14.48333 | G323: 20.41611 | H323: 14.47955 | I323: 20.447330000000001
A324: 1999 CA32-016.FIT | B324: 38483 | D324: 26 | E324: 1999 CA32' | F324: 14.47556 | G324: 24.866109999999999 | H324: 14.471299999999999 | I324: 24.894179999999999
A325: UNION-002.FIT | B325: 38482 | D325: 26 | E325: UNION' | F325: 14.05444 | G325: 19.516670000000001 | H325: 14.05067 | I325: 19.54806
A326: 2000 PT6-017.FIT | B326: 38483 | D326: 26 | E326: 2000 PT6' | F326: 14.00333 | G326: 19.116109999999999 | H326: 13.99934 | I326: 19.145289999999999
A327: 2001 CU20-C.fits | B327: 38483 | D327: 104 | E327: 2001 CU20' | F327: 14.48222 | G327: 20.399439999999998 | H327: 14.478389999999999 | I327: 20.437629999999999
A328: UNION-A.fits | B328: 38482 | D328: 130 | E328: UNION' | F328: 14.05444 | G328: 19.516670000000001 | H328: 14.050660000000001 | I328: 19.548089999999998
A329: 2000 PT6-C.fits | B329: 38483 | D329: 78 | E329: 2000 PT6' | F329: 14.00333 | G329: 19.116109999999999 | H329: 13.99935 | I329: 19.145489999999999
A330: 1991 XE-003.FIT | B330: 38482 | D330: 26 | E330: 1991 XE' | F330: 14.661110000000001 | G330: 19.816109999999998 | H330: 14.657870000000001 | I330: 19.84244
A331: 1999 CA32-A.fits | B331: 38482 | D331: 52 | E331: 1999 CA32' | F331: 14.474170000000001 | G331: 24.866109999999999 | H331: 14.47101 | I331: 24.902349999999998
A332: 2001 BG51-006.FIT | B332: 38483 | D332: 26 | E332: 2001 BG51' | F332: 16.517779999999998 | G332: 26.199439999999999 | H332: 16.514019999999999 | I332: 26.226590000000002
A333: 1988 RE-017.FIT | B333: 38483 | D333: 26 | E333: 1988 RE' | F333: 16.44 | G333: 28.13306 | H333: 16.436679999999999 | I333: 28.159469999999999
A334: MCCLEESE-003.FIT | B334: 38483 | D334: 26 | E334: MCCLEESE' | F334: 16.267779999999998 | G334: 31.182780000000001 | H334: 16.2651 | I334: 31.209209999999999
A335: 1998 WF1-001.FIT | B335: 38483 | D335: 26 | E335: 1998 WF1' | F335: 15.144439999999999 | G335: 35.449440000000003 | H335: 15.139480000000001 | I335: 35.440620000000003
A336: MCCLEESE-A.fits | B336: 38483 | D336: 78 | E336: MCCLEESE' | F336: 16.267779999999998 | G336: 31.182780000000001 | H336: 16.265090000000001 | I336: 31.209230000000002
A337: 1988 RE-C.fits | B337: 38483 | D337: 78 | E337: 1988 RE' | F337: 16.44 | G337: 28.13278 | H337: 16.436710000000001 | I337: 28.1602
A338: 1998 WF1-C.fits | B338: 38483 | D338: 78 | E338: 1998 WF1' | F338: 15.143330000000001 | G338: 35.449440000000003 | H338: 15.14 | I338: 35.470419999999997
A339: 2001 BG51-C.fits | B339: 38483 | D339: 78 | E339: 2001 BG51' | F339: 16.516670000000001 | G339: 26.21611 | H339: 16.513300000000001 | I339: 26.232279999999999
A340: 1991 XE-A.fits | B340: 38486 | D340: 78 | E340: 1991 XE' | F340: 14.557779999999999 | G340: 18.96611 | H340: 14.55377 | I340: 19.005549999999999
A341: 1991 XE-B.fits | B341: 38486 | D341: 52 | E341: 1991 XE' | F341: 14.55889 | G341: 18.96611 | H341: 14.554790000000001 | I341: 19.005389999999998
A342: 1991 XE-C.fits | B342: 38486 | D342: 78 | E342: 1991 XE' | F342: 14.557779999999999 | G342: 18.982780000000002 | H342: 14.55434 | I342: 19.009499999999999
A343: Kevo-A.fits | B343: 38486 | D343: 78 | E343: KEVO' | F343: 14.668889999999999 | G343: 13.48278 | H343: 14.665649999999999 | I343: 13.51609
A344: Kevo-B.fits | B344: 38486 | D344: 78 | E344: KEVO' | F344: 14.67 | G344: 13.49972 | H344: 14.665889999999999 | I344: 13.53206
A345: Kevo-C.fits | B345: 38486 | D345: 78 | E345: KEVO' | F345: 14.668889999999999 | G345: 13.49944 | H345: 14.66526 | I345: 13.53628
A346: 1992 EX8-A.fits | B346: 38492 | D346: 120 | E346: 1992 EX8' | F346: 15.71 | G346: 5.8327799999999996 | H346: 15.706519999999999 | I346: 5.8581099999999999
A347: 1992 EX8-B.fits | B347: 38492 | D347: 120 | E347: 1992 EX8' | F347: 15.71 | G347: 5.8327799999999996 | H347: 15.70595 | I347: 5.86158
A348: 1992 EX8-C.fits | B348: 38492 | D348: 120 | E348: 1992 EX8' | F348: 15.71 | G348: 5.8327799999999996 | H348: 15.706099999999999 | I348: 5.8628200000000001
A349: 2000 AU195-A.fits | B349: 38492 | D349: 120 | E349: 2000 AU195' | F349: 15.75 | G349: 5.0161100000000003 | H349: 15.74596 | I349: 5.0460799999999999
A350: 2000 AU195-B.fits | B350: 38492 | D350: 96 | E350: 2000 AU195' | F350: 15.75 | G350: 5.0327799999999998 | H350: 15.74652 | I350: 5.0538400000000001
A351: 2000 AU195-C.fits | B351: 38492 | D351: 96 | E351: 2000 AU195' | F351: 15.75 | G351: 5.0330599999999999 | H351: 15.74532 | I351: 5.05105
A352: ASPORINA-A.fits | B352: 38492 | D352: 120 | E352: ASPORINA' | F352: 15.772220000000001 | G352: 5.98278 | H352: 15.76825 | I352: 6.0069900000000001
A353: ASPORINA-B.fits | B353: 38492 | D353: 96 | E353: ASPORINA' | F353: 15.77111 | G353: 5.98278 | H353: 15.766970000000001 | I353: 5.9993100000000004
A354: ASPORINA-C.fits | B354: 38492 | D354: 120 | E354: ASPORINA' | F354: 15.77111 | G354: 5.98278 | H354: 15.76722 | I354: 6.0013399999999999
A355: Otzi-A.fits | B355: 38492 | D355: 72 | E355: OTZI' | F355: 15.94444 | G355: 5.7494399999999999 | H355: 15.940630000000001 | I355: 5.7698
A356: Otzi-B.fits | B356: 38492 | D356: 96 | E356: OTZI' | F356: 15.94333 | G356: 5.7494399999999999 | H356: 15.93974 | I356: 5.7736900000000002
A357: Otzi-C.fits | B357: 38492 | D357: 72 | E357: OTZI' | F357: 15.94333 | G357: 5.7494399999999999 | H357: 15.939690000000001 | I357: 5.7762599999999997
A358: 1994 NB-002.FIT | B358: 38509 | D358: 24 | E358: 1994 NB' | F358: 17.99 | G358: 13.63278 | H358: 17.986419999999999 | I358: 13.642530000000001
A359: GRIEVE-002.FIT | B359: 38509 | D359: 24 | E359: GRIEVE' | F359: 18.32 | G359: 17.2 | H359: 18.316759999999999 | I359: 17.20973
A360: GRIEVE-004.FIT | B360: 38509 | D360: 24 | E360: GRIEVE' | F360: 18.32 | G360: 17.216390000000001 | H360: 18.316800000000001 | I360: 17.217949999999998
A361: GRIEVE-005.FIT | B361: 38509 | D361: 24 | E361: GRIEVE' | F361: 18.32 | G361: 17.216390000000001 | H361: 18.316050000000001 | I361: 17.213059999999999
A362: 1994 NB-003.FIT | B362: 38509 | D362: 24 | E362: 1994 NB' | F362: 17.99 | G362: 13.63278 | H362: 17.987310000000001 | I362: 13.63902
A363: 1994 NB-006.FIT | B363: 38509 | D363: 24 | E363: 1994 NB' | F363: 17.988890000000001 | G363: 13.616110000000001 | H363: 17.98546 | I363: 13.63158
A364: 2000 AC126-002.FIT | B364: 38510 | D364: 24 | E364: 2000 AC126' | F364: 16.54889 | G364: 2.59944 | H364: 16.545300000000001 | I364: 2.62215
A365: 2000 AC126-001.FIT | B365: 38510 | D365: 24 | E365: 2000 AC126' | F365: 16.55 | G365: 2.59944 | H365: 16.545210000000001 | I365: 2.6224799999999999
A366: 2000 AC126-003.FIT | B366: 38510 | D366: 24 | E366: 2000 AC126' | F366: 16.55 | G366: 2.59944 | H366: 16.545249999999999 | I366: 2.6220400000000001
A367: VERBANO-001.FIT | B367: 38511 | D367: 24 | E367: VERBANO' | F367: 16.52778 | G367: =--0.68361 -> 0.68361000000000005 | H367: 16.523260000000001 | I367: -1.27972
A368: 1992 JE-002.FIT | B368: 38521 | D368: 24 | E368: 1992 JE' | F368: 16.41778 | G368: 2.7997200000000002 | H368: 16.414079999999998 | I368: 2.8164500000000001
A369: 1992 JE-005.FIT | B369: 38521 | D369: 24 | E369: 1992 JE' | F369: 16.41778 | G369: 2.7497199999999999 | H369: 16.413340000000002 | I369: 2.7738
A370: 1992 JE-007.FIT | B370: 38521 | D370: 24 | E370: 1992 JE' | F370: 16.41778 | G370: 2.7994400000000002 | H370: 16.41367 | I370: 2.7840699999999998
A371: MCFADDEN-002.FIT | B371: 38521 | D371: 24 | E371: MCFADDEN' | F371: 16.406669999999998 | G371: 2.4994399999999999 | H371: 16.402850000000001 | I371: 2.5149599999999999
A372: MCFADDEN-005.FIT | B372: 38521 | D372: 24 | E372: MCFADDEN' | F372: 16.406669999999998 | G372: 2.4994399999999999 | H372: 16.40231 | I372: 2.5263599999999999
A373: MCFADDEN-009.FIT | B373: 38521 | D373: 24 | E373: MCFADDEN' | F373: 16.405560000000001 | G373: 2.4994399999999999 | H373: 16.401859999999999 | I373: 2.5197799999999999
A374: 2000 AC126-005.FIT | B374: 38521 | D374: 24 | E374: 2000 AC126' | F374: 16.394439999999999 | G374: 1.8666700000000001 | H374: 16.3902 | I374: 1.88053
A375: 2000 AC126-007.FIT | B375: 38521 | D375: 24 | E375: 2000 AC126' | F375: 16.394439999999999 | G375: 1.84972 | H375: 16.391200000000001 | I375: 1.86961
A376: VERBANO-002.FIT | B376: 38521 | D376: 24 | E376: VERBANO' | F376: 16.394439999999999 | G376: =--0.76694 -> 0.76693999999999996 | H376: 16.389610000000001 | I376: -1.2346900000000001
A377: VERBANO-005.FIT | B377: 38521 | D377: 24 | E377: VERBANO' | F377: 16.393329999999999 | G377: =--0.75056 -> 0.75056 | H377: 16.389379999999999 | I377: -1.23891
A378: VERBANO-009.FIT | B378: 38521 | D378: 24 | E378: VERBANO' | F378: 16.393329999999999 | G378: =--0.76694 -> 0.76693999999999996 | H378: 16.389140000000001 | I378: -1.2294799999999999
A379: 1992 JE-001.FIT | B379: 38521 | D379: 24 | E379: 1992 JE' | F379: 16.41778 | G379: 2.7994400000000002 | H379: 16.413879999999999 | I379: 2.8165399999999998
A380: 2000 AC126-003.FIT | B380: 38521 | D380: 24 | E380: 2000 AC126' | F380: 16.39556 | G380: 1.84972 | H380: 16.390619999999998 | I380: 1.8688899999999999
A381: MCFADDEN-001.FIT | B381: 38521 | D381: 24 | E381: MCFADDEN' | F381: 16.406669999999998 | G381: 2.4994399999999999 | H381: 16.402729999999998 | I381: 2.5151300000000001
A382: VERBANO-006.FIT | B382: 38521 | D382: 24 | E382: VERBANO' | F382: 16.393329999999999 | G382: =--0.75056 -> 0.75056 | H382: 16.389299999999999 | I382: -1.23912
A383: 1992 JE-002.FIT | B383: 38543 | D383: 24 | E383: 1992 JE' | F383: 16.678889999999999 | G383: 6.1663899999999998 | H383: 16.675219999999999 | I383: 6.1905299999999999
A384: 1992 JE-005.FIT | B384: 38543 | D384: 24 | E384: 1992 JE' | F384: 16.678889999999999 | G384: 6.1994400000000001 | H384: 16.67417 | I384: 6.19489
A385: 1992 JE-009.FIT | B385: 38543 | D385: 24 | E385: 1992 JE' | F385: 16.68 | G385: 6.1994400000000001 | H385: 16.67388 | I385: 6.18696
A386: 1996 HW1-001.FIT | B386: 38543 | D386: 24 | E386: 1996 HW1' | F386: 17.297779999999999 | G386: 0.68278000000000005 | H386: 17.293220000000002 | I386: 0.70901000000000003
A387: 1996 HW1-005.FIT | B387: 38543 | D387: 24 | E387: 1996 HW1' | F387: 17.297779999999999 | G387: 0.68278000000000005 | H387: 17.294509999999999 | I387: 0.70267000000000002
A388: 1996 HW1-009.FIT | B388: 38543 | D388: 24 | E388: 1996 HW1' | F388: 17.297779999999999 | G388: 0.66666999999999998 | H388: 17.293240000000001 | I388: 0.69271000000000005
A389: 1999 JD6-001.FIT | B389: 38543 | D389: 24 | E389: 1999 JD6' | F389: 17.898890000000002 | G389: 11.46611 | H389: 17.894169999999999 | I389: 11.48169
A390: 1999 JD6-005.FIT | B390: 38543 | D390: 24 | E390: 1999 JD6' | F390: 17.89667 | G390: 11.46611 | H390: 17.891010000000001 | I390: 11.479649999999999
A391: 1999 JD6-012.FIT | B391: 38543 | D391: 24 | E391: 1999 JD6' | F391: 17.893329999999999 | G391: 11.46611 | H391: 17.889959999999999 | I391: 11.47124
A392: 2001 LF-001.FIT | B392: 38543 | D392: 24 | E392: 2001 LF' | F392: 17.496670000000002 | G392: 2.6327799999999999 | H392: 17.49241 | I392: 2.6321400000000001
A393: 2001 LF-005.FIT | B393: 38543 | D393: 24 | E393: 2001 LF' | F393: 17.496670000000002 | G393: 2.6497199999999999 | H393: 17.491610000000001 | I393: 2.63957
A394: 2001 LF-011.FIT | B394: 38543 | D394: 24 | E394: 2001 LF' | F394: 17.497779999999999 | G394: 2.6327799999999999 | H394: 17.494150000000001 | I394: 2.6506699999999999
A395: 2002 EX12-002.FIT | B395: 38543 | D395: 24 | E395: 2002 EX12' | F395: 19.496670000000002 | G395: 19.066389999999998 | H395: 19.49335 | I395: 19.064139999999998
A396: 2002 EX12-006.FIT | B396: 38543 | D396: 24 | E396: 2002 EX12' | F396: 19.496670000000002 | G396: 19.08278 | H396: 19.493770000000001 | I396: 19.081710000000001
A397: 2002 EX12-012.FIT | B397: 38543 | D397: 24 | E397: 2002 EX12' | F397: 19.496670000000002 | G397: 19.13278 | H397: 19.493300000000001 | I397: 19.126899999999999
A398: JENSMARTIN-004.FIT | B398: 38541 | D398: 24 | E398: JENSMARTIN' | F398: 19.662220000000001 | G398: 20.533059999999999 | H398: 19.658919999999998 | I398: 20.530439999999999
A399: JENSMARTIN-006.FIT | B399: 38541 | D399: 24 | E399: JENSMARTIN' | F399: 19.661110000000001 | G399: 20.533059999999999 | H399: 19.65775 | I399: 20.52966
A400: JENSMARTIN-009.FIT | B400: 38541 | D400: 24 | E400: JENSMARTIN' | F400: 19.662220000000001 | G400: 20.516110000000001 | H400: 19.658480000000001 | I400: 20.52758
A401: NANCYGREEN-004.FIT | B401: 38541 | D401: 24 | E401: NANCYGREEN' | F401: 20.48 | G401: 25.71611 | H401: 20.476769999999998 | I401: 25.710139999999999
A402: NANCYGREEN-005.FIT | B402: 38541 | D402: 24 | E402: NANCYGREEN' | F402: 20.481110000000001 | G402: 25.74972 | H402: 20.47906 | I402: 25.72401
A403: NANCYGREEN-012.FIT | B403: 38541 | D403: 24 | E403: NANCYGREEN' | F403: 20.48 | G403: 25.766110000000001 | H403: 20.47634 | I403: 25.761130000000001
A404: SHELTON-003.FIT | B404: 38541 | D404: 24 | E404: SHELTON' | F404: 18.496670000000002 | G404: 5.5494399999999997 | H404: 18.492660000000001 | I404: 5.5566800000000001
A405: SHELTON-007.FIT | B405: 38541 | D405: 24 | E405: SHELTON' | F405: 18.494440000000001 | G405: 5.5333300000000003 | H405: 18.490829999999999 | I405: 5.5420600000000002
A406: SHELTON-009.FIT | B406: 38541 | D406: 24 | E406: SHELTON' | F406: 18.495560000000001 | G406: 5.5494399999999997 | H406: 18.49126 | I406: 5.5310699999999997
A407: 1999 JD6-001.FIT | B407: 38541 | D407: 24 | E407: 1999 JD6' | F407: 18.12 | G407: 11.949439999999999 | H407: 18.116009999999999 | I407: 11.9559
A408: 1999 JD6-006.FIT | B408: 38541 | D408: 24 | E408: 1999 JD6' | F408: 18.11778 | G408: 11.949439999999999 | H408: 18.11336 | I408: 11.9526
A409: 1999 JD6-011.FIT | B409: 38541 | D409: 24 | E409: 1999 JD6' | F409: 18.114170000000001 | G409: 11.932779999999999 | H409: 18.110810000000001 | I409: 11.94713
A410: 2002 EX12-012.FIT | B410: 38544 | D410: 25 | E410: 2002 EX12' | F410: 19.461110000000001 | G410: 19.982780000000002 | H410: 19.45787 | I410: 19.973400000000002
A411: LEUSCHNERIA-004.FIT | B411: 38544 | D411: 25 | E411: LEUSCHNERIA' | F411: 19.844439999999999 | G411: 4.8161100000000001 | H411: 19.840129999999998 | I411: 4.8128500000000001
A412: LEUSCHNERIA-006.FIT | B412: 38544 | D412: 25 | E412: LEUSCHNERIA' | F412: 19.844439999999999 | G412: 4.8327799999999996 | H412: 19.840219999999999 | I412: 4.8279199999999998
A413: LEUSCHNERIA-012.FIT | B413: 38544 | D413: 25 | E413: LEUSCHNERIA' | F413: 19.844439999999999 | G413: 4.8327799999999996 | H413: 19.840489999999999 | I413: 4.82484
A414: PRAXEDIS-003.FIT | B414: 38544 | D414: 25 | E414: PRAXEDIS' | F414: 19.88222 | G414: 5.6327800000000003 | H414: 19.877929999999999 | I414: 5.62134
A415: PRAXEDIS-012.FIT | B415: 38544 | D415: 25 | E415: PRAXEDIS' | F415: 19.88222 | G415: 5.6327800000000003 | H415: 19.877960000000002 | I415: 5.6338600000000003
A416: 2001 QZ29-001.FIT | B416: 38544 | D416: 25 | E416: 2001 QZ29' | F416: 20.098890000000001 | G416: 3.09944 | H416: 20.09534 | I416: 3.0842700000000001
A417: 2001 QZ29-002.FIT | B417: 38544 | D417: 25 | E417: 2001 QZ29' | F417: 20.1 | G417: 3.09944 | H417: 20.095490000000002 | I417: 3.08439
A418: 2001 QZ29-005.FIT | B418: 38544 | D418: 25 | E418: 2001 QZ29' | F418: 20.098890000000001 | G418: 3.09944 | H418: 20.094930000000002 | I418: 3.1014900000000001
A419: 2001 QZ29-006.FIT | B419: 38544 | D419: 25 | E419: 2001 QZ29' | F419: 20.098890000000001 | G419: 3.1161099999999999 | H419: 20.095020000000002 | I419: 3.1014900000000001
A420: 2001 QZ29-011.FIT | B420: 38544 | D420: 25 | E420: 2001 QZ29' | F420: 20.101109999999998 | G420: 3.09944 | H420: 20.096530000000001 | I420: 3.0995300000000001
A421: 2001 QZ29-012.FIT | B421: 38544 | D421: 25 | E421: 2001 QZ29' | F421: 20.101109999999998 | G421: 3.09944 | H421: 20.09667 | I421: 3.0994600000000001
A422: PRAXEDIS-001.FIT | B422: 38544 | D422: 25 | E422: PRAXEDIS' | F422: 19.88222 | G422: 5.6327800000000003 | H422: 19.877320000000001 | I422: 5.7276100000000003
A423: PRAXEDIS-002.FIT | B423: 38544 | D423: 25 | E423: PRAXEDIS' | F423: 19.88222 | G423: 5.6327800000000003 | H423: 19.87717 | I423: 5.7276699999999998
A424: PRAXEDIS-007.FIT | B424: 38544 | D424: 25 | E424: PRAXEDIS' | F424: 19.883330000000001 | G424: 5.61639 | H424: 19.87921 | I424: 5.6156699999999997
A425: PRAXEDIS-008.FIT | B425: 38544 | D425: 25 | E425: PRAXEDIS' | F425: 19.883330000000001 | G425: 5.61639 | H425: 19.879359999999998 | I425: 5.6154799999999998
A426: PRAXEDIS-009.FIT | B426: 38544 | D426: 25 | E426: PRAXEDIS' | F426: 19.88222 | G426: 5.6327800000000003 | H426: 19.87764 | I426: 5.6340599999999998
A427: PRAXEDIS-010.FIT | B427: 38544 | D427: 25 | E427: PRAXEDIS' | F427: 19.88222 | G427: 5.6327800000000003 | H427: 19.87754 | I427: 5.6339699999999997
A428: HAMSUN-001.FIT | B428: 38544 | D428: 25 | E428: HAMSUN' | F428: 19.671109999999999 | G428: 3.0327799999999998 | H428: 19.666789999999999 | I428: 3.0349200000000001
A429: HAMSUN-003.FIT | B429: 38544 | D429: 25 | E429: HAMSUN' | F429: 19.671109999999999 | G429: 3.0327799999999998 | H429: 19.66703 | I429: 3.0348199999999999
A430: HAMSUN-005.FIT | B430: 38544 | D430: 25 | E430: HAMSUN' | F430: 19.671109999999999 | G430: 3.0327799999999998 | H430: 19.66703 | I430: 3.0325500000000001
A431: HAMSUN-006.FIT | B431: 38544 | D431: 25 | E431: HAMSUN' | F431: 19.671109999999999 | G431: 3.0327799999999998 | H431: 19.66723 | I431: 3.0323699999999998
A432: HAMSUN-009.FIT | B432: 38544 | D432: 25 | E432: HAMSUN' | F432: 19.671109999999999 | G432: 3.0327799999999998 | H432: 19.666599999999999 | I432: 3.0294500000000002
A433: HAMSUN-010.FIT | B433: 38544 | D433: 25 | E433: HAMSUN' | F433: 19.671109999999999 | G433: 3.0327799999999998 | H433: 19.66685 | I433: 3.0290300000000001
A434: 2002 EX12-001.FIT | B434: 38544 | D434: 25 | E434: 2002 EX12' | F434: 19.463329999999999 | G434: 19.949439999999999 | H434: 19.459969999999998 | I434: 19.94746
A435: 2002 EX12-002.FIT | B435: 38544 | D435: 25 | E435: 2002 EX12' | F435: 19.463329999999999 | G435: 19.949439999999999 | H435: 19.460129999999999 | I435: 19.947340000000001
A436: 2002 EX12-006.FIT | B436: 38544 | D436: 25 | E436: 2002 EX12' | F436: 19.463329999999999 | G436: 19.96611 | H436: 19.459040000000002 | I436: 19.960329999999999
A437: 2002 EX12-007.FIT | B437: 38544 | D437: 25 | E437: 2002 EX12' | F437: 19.462219999999999 | G437: 19.96611 | H437: 19.459050000000001 | I437: 19.96021
A438: 2002 EX12-009.FIT | B438: 38544 | D438: 25 | E438: 2002 EX12' | F438: 19.462219999999999 | G438: 19.982780000000002 | H438: 19.457999999999998 | I438: 19.97354
A439: 2002 EX12-011.FIT | B439: 38544 | D439: 25 | E439: 2002 EX12' | F439: 19.461110000000001 | G439: 19.982780000000002 | H439: 19.457799999999999 | I439: 19.973400000000002
A440: 2002 EX12-005.FIT | B440: 38545 | D440: 25 | E440: 2002 EX12' | F440: 19.427779999999998 | G440: 20.849440000000001 | H440: 19.424040000000002 | I440: 20.843630000000001
A441: 2002 EX12-012.FIT | B441: 38545 | D441: 25 | E441: 2002 EX12' | F441: 19.427779999999998 | G441: 20.866109999999999 | H441: 19.42427 | I441: 20.858640000000001
A442: 2002 EX12-016.FIT | B442: 38545 | D442: 25 | E442: 2002 EX12' | F442: 19.426670000000001 | G442: 20.88278 | H442: 19.422529999999998 | I442: 20.872420000000002
A443: BROWNLEE-002.FIT | B443: 38545 | D443: 25 | E443: BROWNLEE' | F443: 19.716670000000001 | G443: =--1.03389 -> 1.03389 | H443: 19.711929999999999 | I443: -2.99315
A444: BROWNLEE-006.FIT | B444: 38545 | D444: 25 | E444: BROWNLEE' | F444: 19.716670000000001 | G444: =--1.03389 -> 1.03389 | H444: 19.712859999999999 | I444: -2.9930599999999998
A445: BROWNLEE-007.FIT | B445: 38545 | D445: 25 | E445: BROWNLEE' | F445: 19.716670000000001 | G445: =--1.03389 -> 1.03389 | H445: 19.71161 | I445: -2.9958800000000001
A446: GOLDSCHMIDT-001.FIT | B446: 38545 | D446: 25 | E446: GOLDSCHMIDT' | F446: 20.067779999999999 | G446: =--4.41722 -> 4.4172200000000004 | H446: 20.063289999999999 | I446: -5.5724200000000002
A447: GOLDSCHMIDT-007.FIT | B447: 38545 | D447: 25 | E447: GOLDSCHMIDT' | F447: 20.067779999999999 | G447: =--4.45056 -> 4.4505600000000003 | H447: 20.063130000000001 | I447: -5.5705799999999996
A448: GOLDSCHMIDT-009.FIT | B448: 38545 | D448: 25 | E448: GOLDSCHMIDT' | F448: 20.067779999999999 | G448: =--4.41722 -> 4.4172200000000004 | H448: 20.063559999999999 | I448: -5.5716000000000001
A449: Keck-001.fit | B449: 38545 | D449: 25 | E449: KECK' | F449: 20.463329999999999 | G449: 2.23333 | H449: 20.459910000000001 | I449: 2.21434
A450: Keck-006.fit | B450: 38545 | D450: 25 | E450: KECK' | F450: 20.463329999999999 | G450: 2.2497199999999999 | H450: 20.458580000000001 | I450: 2.2359399999999998
A451: Keck-007.fit | B451: 38545 | D451: 25 | E451: KECK' | F451: 20.462219999999999 | G451: 2.23333 | H451: 20.458760000000002 | I451: 2.23576
A452: MAYRHOFER-001.FIT | B452: 38545 | D452: 25 | E452: MAYRHOFER' | F452: 19.647780000000001 | G452: =--2.23333 -> 2.23333 | H452: 19.64339 | I452: -3.7909299999999999
A453: MAYRHOFER-007.FIT | B453: 38545 | D453: 25 | E453: MAYRHOFER' | F453: 19.647780000000001 | G453: =--2.23333 -> 2.23333 | H453: 19.642749999999999 | I453: -3.7913199999999998
A454: MAYRHOFER-009.FIT | B454: 38545 | D454: 25 | E454: MAYRHOFER' | F454: 19.647780000000001 | G454: =--2.23333 -> 2.23333 | H454: 19.639479999999999 | I454: -3.8437800000000002
A455: 2002 EX12-002.FIT | B455: 38545 | D455: 25 | E455: 2002 EX12' | F455: 19.427779999999998 | G455: 20.849440000000001 | H455: 19.424209999999999 | I455: 20.843769999999999
A456: 2002 EX12-003.FIT | B456: 38545 | D456: 25 | E456: 2002 EX12' | F456: 19.427779999999998 | G456: 20.849440000000001 | H456: 19.424340000000001 | I456: 20.84374
A457: 2002 EX12-008.FIT | B457: 38545 | D457: 25 | E457: 2002 EX12' | F457: 19.427779999999998 | G457: 20.866109999999999 | H457: 19.423839999999998 | I457: 20.85894
A458: 2002 EX12-009.FIT | B458: 38545 | D458: 25 | E458: 2002 EX12' | F458: 19.427779999999998 | G458: 20.866109999999999 | H458: 19.424040000000002 | I458: 20.858830000000001
A459: 2002 EX12-014.FIT | B459: 38545 | D459: 25 | E459: 2002 EX12' | F459: 19.426670000000001 | G459: 20.88278 | H459: 19.422409999999999 | I459: 20.87257
A460: 2002 EX12-015.FIT | B460: 38545 | D460: 25 | E460: 2002 EX12' | F460: 19.425560000000001 | G460: 20.88278 | H460: 19.422519999999999 | I460: 20.87236
A461: 2002 EX12-A.fits | B461: 38545 | D461: 100 | E461: 2002 EX12' | F461: 19.427779999999998 | G461: 20.849440000000001 | H461: 19.424209999999999 | I461: 20.843769999999999
A462: 2002 EX12-B.fits | B462: 38545 | D462: 100 | E462: 2002 EX12' | F462: 19.427779999999998 | G462: 20.866109999999999 | H462: 19.423839999999998 | I462: 20.85894
A463: 2002 EX12-C.fits | B463: 38545 | D463: 100 | E463: 2002 EX12' | F463: 19.426670000000001 | G463: 20.88278 | H463: 19.422409999999999 | I463: 20.872589999999999
A464: EX12-An1.fit | B464: 38545 | D464: 25 | E464: 2002 EX12' | F464: 19.427779999999998 | G464: 20.849440000000001 | H464: 19.424040000000002 | I464: 20.843630000000001
A465: EX12-An2.fit | B465: 38545 | D465: 25 | E465: 2002 EX12' | F465: 19.427779999999998 | G465: 20.866109999999999 | H465: 19.42427 | I465: 20.858640000000001
A466: EX12-An3.fit | B466: 38545 | D466: 25 | E466: 2002 EX12' | F466: 19.426670000000001 | G466: 20.88278 | H466: 19.422529999999998 | I466: 20.872420000000002
A467: 2002 EX12-A.fits | B467: 38548 | D467: 130 | E467: 2002 EX12' | F467: 19.301110000000001 | G467: 23.899439999999998 | H467: 19.296289999999999 | I467: 23.866969999999998
A468: 2002 EX12-B.fits | B468: 38548 | D468: 104 | E468: 2002 EX12' | F468: 19.29889 | G468: 23.91611 | H468: 19.294339999999998 | I468: 23.87886
A469: 2002 EX12-001.FIT | B469: 38548 | D469: 26 | E469: 2002 EX12' | F469: 19.301110000000001 | G469: 23.899439999999998 | H469: 19.296289999999999 | I469: 23.866969999999998
A470: 2002 EX12-002.FIT | B470: 38548 | D470: 26 | E470: 2002 EX12' | F470: 19.299720000000001 | G470: 23.866109999999999 | H470: 19.296340000000001 | I470: 23.866969999999998
A471: 2002 EX12-007.FIT | B471: 38548 | D471: 26 | E471: 2002 EX12' | F471: 19.29889 | G471: 23.91611 | H471: 19.294339999999998 | I471: 23.87886
A472: 2002 EX12-008.FIT | B472: 38548 | D472: 26 | E472: 2002 EX12' | F472: 19.297779999999999 | G472: 23.88278 | H472: 19.294329999999999 | I472: 23.878689999999999
A473: JENSMARTIN-003.FIT | B473: 38549 | D473: 26 | E473: JENSMARTIN' | F473: 19.525559999999999 | G473: 21.16611 | H473: 19.52216 | I473: 21.16987
A474: JENSMARTIN-011.FIT | B474: 38549 | D474: 26 | E474: JENSMARTIN' | F474: 19.524439999999998 | G474: 21.16611 | H474: 19.520330000000001 | I474: 21.166620000000002
A475: JENSMARTIN-016.FIT | B475: 38549 | D475: 26 | E475: JENSMARTIN' | F475: 19.524439999999998 | G475: 21.182780000000001 | H475: 19.519870000000001 | I475: 21.176300000000001
A476: NANCYGREEN-018.FIT | B476: 38549 | D476: 26 | E476: NANCYGREEN' | F476: 20.37 | G476: 26.599440000000001 | H476: 20.365279999999998 | I476: 26.665030000000002
A477: 2002 EX12-002.FIT | B477: 38549 | D477: 26 | E477: 2002 EX12' | F477: 19.251110000000001 | G477: 24.982780000000002 | H477: 19.259899999999998 | I477: 24.967639999999999
A478: 2002 EX12-004.FIT | B478: 38549 | D478: 26 | E478: 2002 EX12' | F478: 19.251110000000001 | G478: 24.982780000000002 | H478: 19.260259999999999 | I478: 24.967099999999999
A479: 2002 EX12-007.FIT | B479: 38549 | D479: 26 | E479: 2002 EX12' | F479: 19.251110000000001 | G479: 24.99944 | H479: 19.24699 | I479: 24.999359999999999
A480: 2002 EX12-008.FIT | B480: 38549 | D480: 26 | E480: 2002 EX12' | F480: 19.25 | G480: 24.99944 | H480: 19.247250000000001 | I480: 24.999300000000002
A481: 2002 EX12-013.FIT | B481: 38549 | D481: 26 | E481: 2002 EX12' | F481: 19.25 | G481: 25.016110000000001 | H481: 19.245750000000001 | I481: 25.011610000000001
A482: 2002 EX12-014.FIT | B482: 38549 | D482: 26 | E482: 2002 EX12' | F482: 19.248889999999999 | G482: 25.016110000000001 | H482: 19.245830000000002 | I482: 25.011590000000002
A483: 2002 EX12-A.fits | B483: 38549 | D483: 104 | E483: 2002 EX12' | F483: 19.251110000000001 | G483: 24.982780000000002 | H483: 19.24803 | I483: 24.98068
A484: 2002 EX12-B.fits | B484: 38549 | D484: 156 | E484: 2002 EX12' | F484: 19.251110000000001 | G484: 24.99944 | H484: 19.247 | I484: 24.999389999999998
A485: 2002 EX12-C.fits | B485: 38549 | D485: 156 | E485: 2002 EX12' | F485: 19.25 | G485: 25.016110000000001 | H485: 19.245750000000001 | I485: 25.01164
A486: NANCYGREEN-001.FIT | B486: 38549 | D486: 26 | E486: NANCYGREEN' | F486: 20.37 | G486: 26.599440000000001 | H486: 20.365829999999999 | I486: 26.582560000000001
A487: NANCYGREEN-002.FIT | B487: 38549 | D487: 26 | E487: NANCYGREEN' | F487: 20.36889 | G487: 26.599440000000001 | H487: 20.365970000000001 | I487: 26.582429999999999
A488: NANCYGREEN-007.FIT | B488: 38549 | D488: 26 | E488: NANCYGREEN' | F488: 20.36889 | G488: 26.599440000000001 | H488: 20.366129999999998 | I488: 26.582560000000001
A489: NANCYGREEN-008.FIT | B489: 38549 | D489: 26 | E489: NANCYGREEN' | F489: 20.37 | G489: 26.599440000000001 | H489: 20.36628 | I489: 26.58249
A490: NANCYGREEN-013.FIT | B490: 38549 | D490: 26 | E490: NANCYGREEN' | F490: 20.36889 | G490: 26.599440000000001 | H490: 20.366070000000001 | I490: 26.598099999999999
A491: NANCYGREEN-014.FIT | B491: 38549 | D491: 26 | E491: NANCYGREEN' | F491: 20.37 | G491: 26.599440000000001 | H491: 20.366330000000001 | I491: 26.59798
A492: NANCYGREEN-A.fits | B492: 38549 | D492: 104 | E492: NANCYGREEN' | F492: 20.37 | G492: 26.599440000000001 | H492: 20.360959999999999 | I492: 26.727340000000002
A493: NANCYGREEN-B.fits | B493: 38549 | D493: 130 | E493: NANCYGREEN' | F493: 20.36889 | G493: 26.599440000000001 | H493: 20.361280000000001 | I493: 26.72803
A494: NANCYGREEN-C.fits | B494: 38549 | D494: 130 | E494: NANCYGREEN' | F494: 20.36889 | G494: 26.599440000000001 | H494: 20.36111 | I494: 26.742370000000001
A495: DEMETER-002.FIT | B495: 38550 | D495: 26 | E495: DEMETER' | F495: 23.67333 | G495: 35.96611 | H495: 23.66873 | I495: 35.949759999999998
A496: DEMETER-001.FIT | B496: 38550 | D496: 26 | E496: DEMETER' | F496: 23.672219999999999 | G496: 35.99944 | H496: 23.668589999999998 | I496: 35.949309999999997
A497: DEMETER-007.FIT | B497: 38550 | D497: 26 | E497: DEMETER' | F497: 23.672219999999999 | G497: 35.99944 | H497: 23.66882 | I497: 35.995429999999999
A498: DEMETER-015.FIT | B498: 38550 | D498: 26 | E498: DEMETER' | F498: 23.671109999999999 | G498: 36.032780000000002 | H498: 23.667439999999999 | I498: 36.004710000000003
A499: NONIE-006.FIT | B499: 38550 | D499: 26 | E499: NONIE' | F499: 23.655560000000001 | G499: 43.416110000000003 | H499: 23.651420000000002 | I499: 43.398249999999997
A500: NONIE-010.FIT | B500: 38550 | D500: 26 | E500: NONIE' | F500: 23.654440000000001 | G500: 43.416110000000003 | H500: 23.650469999999999 | I500: 43.38608
A501: 2002 EX12-005.FIT | B501: 38550 | D501: 26 | E501: 2002 EX12' | F501: 19.196670000000001 | G501: 26.149439999999998 | H501: 19.193460000000002 | I501: 26.15269
A502: 2002 EX12-018.FIT | B502: 38550 | D502: 26 | E502: 2002 EX12' | F502: 19.19333 | G502: 26.199439999999999 | H502: 19.189409999999999 | I502: 26.197279999999999
A503: 2002 EX12-A-MB.fits | B503: 38550 | D503: 104 | E503: 2002 EX12' | F503: 19.196670000000001 | G503: 26.149439999999998 | H503: 19.193280000000001 | I503: 26.153089999999999
A504: 2002 EX12-B-MB.fits | B504: 38550 | D504: 130 | E504: 2002 EX12' | F504: 19.196670000000001 | G504: 26.182780000000001 | H504: 19.19088 | I504: 26.166599999999999
A505: 2002 EX12-C-MB.fits | B505: 38550 | D505: 156 | E505: 2002 EX12' | F505: 19.19556 | G505: 26.21611 | H505: 19.18957 | I505: 26.197690000000001
A506: NONIE-001.FIT | B506: 38550 | D506: 26 | E506: NONIE' | F506: 23.65333 | G506: 43.432780000000001 | H506: 23.65062 | I506: 43.397019999999998
A507: NONIE-002.FIT | B507: 38550 | D507: 26 | E507: NONIE' | F507: 23.654440000000001 | G507: 43.416110000000003 | H507: 23.650849999999998 | I507: 43.397370000000002
A508: NONIE-007.FIT | B508: 38550 | D508: 26 | E508: NONIE' | F508: 23.654440000000001 | G508: 43.433059999999998 | H508: 23.650279999999999 | I508: 43.385399999999997
A509: NONIE-008.FIT | B509: 38550 | D509: 26 | E509: NONIE' | F509: 23.654440000000001 | G509: 43.416110000000003 | H509: 23.650359999999999 | I509: 43.385719999999999
A510: NONIE-013.FIT | B510: 38550 | D510: 26 | E510: NONIE' | F510: 23.654440000000001 | G510: 43.449440000000003 | H510: 23.65006 | I510: 43.394129999999997
A511: NONIE-014.FIT | B511: 38550 | D511: 26 | E511: NONIE' | F511: 23.654440000000001 | G511: 43.416110000000003 | H511: 23.650210000000001 | I511: 43.394359999999999
A512: JENNIFER-001.FIT | B512: 38550 | D512: 26 | E512: JENNIFER' | F512: 23.063330000000001 | G512: 40.866669999999999 | H512: 23.059090000000001 | I512: 40.865609999999997
A513: JENNIFER-002.FIT | B513: 38550 | D513: 26 | E513: JENNIFER' | F513: 23.063330000000001 | G513: 40.882779999999997 | H513: 23.059180000000001 | I513: 40.865749999999998
A514: JENNIFER-007.FIT | B514: 38550 | D514: 26 | E514: JENNIFER' | F514: 23.063330000000001 | G514: 40.866669999999999 | H514: 23.060549999999999 | I514: 40.854210000000002
A515: JENNIFER-009.FIT | B515: 38550 | D515: 26 | E515: JENNIFER' | F515: 23.064440000000001 | G515: 40.882779999999997 | H515: 23.06091 | I515: 40.854500000000002
A516: JENNIFER-014.FIT | B516: 38550 | D516: 26 | E516: JENNIFER' | F516: 23.064440000000001 | G516: 40.899439999999998 | H516: 23.060459999999999 | I516: 40.877560000000003
A517: JENNIFER-015.FIT | B517: 38550 | D517: 26 | E517: JENNIFER' | F517: 23.064440000000001 | G517: 40.899439999999998 | H517: 23.060490000000001 | I517: 40.877589999999998
A518: JENNIFER-A.fits | B518: 38550 | D518: 130 | E518: JENNIFER' | F518: 23.063330000000001 | G518: 40.866669999999999 | H518: 23.05911 | I518: 40.866030000000002
A519: JENNIFER-B.fits | B519: 38550 | D519: 78 | E519: JENNIFER' | F519: 23.063330000000001 | G519: 40.866669999999999 | H519: 23.060559999999999 | I519: 40.854509999999998
A520: JENNIFER-C.fits | B520: 38550 | D520: 78 | E520: JENNIFER' | F520: 23.064440000000001 | G520: 40.899439999999998 | H520: 23.060469999999999 | I520: 40.877740000000003
A521: NONIE-A.fits | B521: 38550 | D521: 130 | E521: NONIE' | F521: 23.65333 | G521: 43.432780000000001 | H521: 23.650639999999999 | I521: 43.397379999999998
A522: NONIE-B.fits | B522: 38550 | D522: 130 | E522: NONIE' | F522: 23.654440000000001 | G522: 43.433059999999998 | H522: 23.650300000000001 | I522: 43.385680000000001
A523: NONIE-C.fits | B523: 38550 | D523: 130 | E523: NONIE' | F523: 23.654440000000001 | G523: 43.449440000000003 | H523: 23.650069999999999 | I523: 43.394460000000002
A524: 2002 EX12-002.FIT | B524: 38550 | D524: 26 | E524: 2002 EX12' | F524: 19.196670000000001 | G524: 26.149439999999998 | H524: 19.193280000000001 | I524: 26.153079999999999
A525: 2002 EX12-003.FIT | B525: 38550 | D525: 26 | E525: 2002 EX12' | F525: 19.196670000000001 | G525: 26.149439999999998 | H525: 19.193349999999999 | I525: 26.15307
A526: 2002 EX12-007.FIT | B526: 38550 | D526: 26 | E526: 2002 EX12' | F526: 19.196670000000001 | G526: 26.182780000000001 | H526: 19.19088 | I526: 26.166609999999999
A527: 2002 EX12-008.FIT | B527: 38550 | D527: 26 | E527: 2002 EX12' | F527: 19.19444 | G527: 26.16611 | H527: 19.19087 | I527: 26.16638
A528: 2002 EX12-013.FIT | B528: 38550 | D528: 26 | E528: 2002 EX12' | F528: 19.19556 | G528: 26.21611 | H528: 19.18957 | I528: 26.197679999999998
A529: 2002 EX12-014.FIT | B529: 38550 | D529: 26 | E529: 2002 EX12' | F529: 19.19333 | G529: 26.199439999999999 | H529: 19.189299999999999 | I529: 26.197479999999999
A530: 2002 EX12-A.fits | B530: 38550 | D530: 104 | E530: 2002 EX12' | F530: 19.196670000000001 | G530: 26.149439999999998 | H530: 19.19323 | I530: 26.154039999999998
A531: 2002 EX12-B.fits | B531: 38550 | D531: 130 | E531: 2002 EX12' | F531: 19.196670000000001 | G531: 26.182780000000001 | H531: 19.190829999999998 | I531: 26.167840000000002
A532: 2002 EX12-C.fits | B532: 38550 | D532: 156 | E532: 2002 EX12' | F532: 19.19556 | G532: 26.21611 | H532: 19.189489999999999 | I532: 26.19942
A533: Run1-001.FIT | B533: 38553 | D533: 26 | E533: ' | F533: 22.216670000000001 | G533: 40.516109999999998 | H533: 22.212319999999998 | I533: 40.482280000000003
A534: Run2-001.FIT | B534: 38553 | D534: 26 | E534: ' | F534: 22.216670000000001 | G534: 40.516109999999998 | H534: 22.213190000000001 | I534: 40.502499999999998
A535: Run3-001.FIT | B535: 38553 | D535: 26 | E535: ' | F535: 22.216670000000001 | G535: 40.516109999999998 | H535: 22.21368 | I535: 40.503709999999998
A536: Run1-003.FIT | B536: 38553 | D536: 26 | E536: ' | F536: 22.21556 | G536: 40.666110000000003 | H536: 22.212969999999999 | I536: 40.650260000000003
A537: Run2-003.FIT | B537: 38553 | D537: 26 | E537: ' | F537: 22.216670000000001 | G537: 40.666110000000003 | H537: 22.213439999999999 | I537: 40.653260000000003
A538: Run3-003.FIT | B538: 38553 | D538: 26 | E538: ' | F538: 22.216670000000001 | G538: 40.66639 | H538: 22.212900000000001 | I538: 40.651009999999999
A539: Run1-005.FIT | B539: 38553 | D539: 26 | E539: ' | F539: 22.216670000000001 | G539: 40.83278 | H539: 22.213480000000001 | I539: 40.814149999999998
A540: Run2-006.FIT | B540: 38553 | D540: 26 | E540: ' | F540: 22.21556 | G540: 40.83278 | H540: 22.212479999999999 | I540: 40.816960000000002
A541: Run3-005.FIT | B541: 38553 | D541: 26 | E541: ' | F541: 22.216670000000001 | G541: 40.83278 | H541: 22.213149999999999 | I541: 40.817369999999997
A542: Run1-007.FIT | B542: 38553 | D542: 26 | E542: ' | F542: 22.216670000000001 | G542: 40.99944 | H542: 22.213380000000001 | I542: 40.980510000000002
A543: Run2-007.FIT | B543: 38553 | D543: 26 | E543: ' | F543: 22.216670000000001 | G543: 40.99944 | H543: 22.213629999999998 | I543: 40.982399999999998
A544: Run3-007.FIT | B544: 38553 | D544: 26 | E544: ' | F544: 22.216670000000001 | G544: 40.99944 | H544: 22.213349999999998 | I544: 40.980510000000002
A545: 2001 MV-A.fits | B545: 38553 | D545: 364 | E545: 2001 MV' | F545: 23.85 | G545: 36.916110000000003 | H545: 23.845189999999999 | I545: 36.911389999999997
A546: 2001 MV-B.fits | B546: 38553 | D546: 338 | E546: 2001 MV' | F546: 23.851389999999999 | G546: 36.932780000000001 | H546: 23.847249999999999 | I546: 36.912350000000004
A547: 2001 MV-C.fits | B547: 38554 | D547: 338 | E547: 2001 MV' | F547: 23.85389 | G547: 36.932780000000001 | H547: 23.849250000000001 | I547: 36.913539999999998
A548: 2001 MV-002.FIT | B548: 38553 | D548: 26 | E548: 2001 MV' | F548: 23.848890000000001 | G548: 36.932780000000001 | H548: 23.845359999999999 | I548: 36.909680000000002
A549: 2001 MV-017.FIT | B549: 38553 | D549: 26 | E549: 2001 MV' | F549: 23.851389999999999 | G549: 36.932780000000001 | H549: 23.847159999999999 | I549: 36.910670000000003
A550: 2001 MV-018.FIT | B550: 38553 | D550: 26 | E550: 2001 MV' | F550: 23.851109999999998 | G550: 36.932780000000001 | H550: 23.84712 | I550: 36.910739999999997
A551: 2001 MV-033.FIT | B551: 38554 | D551: 26 | E551: 2001 MV' | F551: 23.85389 | G551: 36.932780000000001 | H551: 23.849170000000001 | I551: 36.912050000000001
A552: 2001 MV-034.FIT | B552: 38554 | D552: 26 | E552: 2001 MV' | F552: 23.85333 | G552: 36.932780000000001 | H552: 23.84937 | I552: 36.912179999999999
A553: 2001 MV-StacA.fits | B553: 38553 | D553: 338 | E553: 2001 MV' | F553: 23.85 | G553: 36.916110000000003 | H553: 23.845109999999998 | I553: 36.90992
A554: 2001 MV-StackB.fits | B554: 38553 | D554: 338 | E554: 2001 MV' | F554: 23.851389999999999 | G554: 36.932780000000001 | H554: 23.847159999999999 | I554: 36.910670000000003
A555: 2001 MV-StackC.fits | B555: 38554 | D555: 338 | E555: 2001 MV' | F555: 23.85389 | G555: 36.932780000000001 | H555: 23.849170000000001 | I555: 36.912059999999997
A556: 2001 MV-001.FIT | B556: 38553 | D556: 26 | E556: 2001 MV' | F556: 23.85 | G556: 36.916110000000003 | H556: 23.845109999999998 | I556: 36.9099
A557: 2000 LY2-004.FIT | B557: 38554 | D557: 26 | E557: 2000 LY2' | F557: 21.905560000000001 | G557: 39.099440000000001 | H557: 21.90211 | I557: 39.083979999999997
A558: 2000 LY2-005.FIT | B558: 38554 | D558: 26 | E558: 2000 LY2' | F558: 21.905560000000001 | G558: 39.099440000000001 | H558: 21.90232 | I558: 39.084069999999997
A559: 2000 LY2-017.FIT | B559: 38554 | D559: 26 | E559: 2000 LY2' | F559: 21.905560000000001 | G559: 39.116109999999999 | H559: 21.900860000000002 | I559: 39.102719999999998
A560: 2000 LY2-019.FIT | B560: 38554 | D560: 26 | E560: 2000 LY2' | F560: 21.904440000000001 | G560: 39.116109999999999 | H560: 21.901050000000001 | I560: 39.102980000000002
A561: 2000 LY2-034.FIT | B561: 38554 | D561: 26 | E561: 2000 LY2' | F561: 21.905560000000001 | G561: 39.116109999999999 | H561: 21.901810000000001 | I561: 39.102359999999997
A562: 2000 LY2-035.FIT | B562: 38554 | D562: 26 | E562: 2000 LY2' | F562: 21.905560000000001 | G562: 39.116109999999999 | H562: 21.90203 | I562: 39.102460000000001
A563: 2000 LY2-C.fits | B563: 38554 | D563: 286 | E563: 2000 LY2' | F563: 21.905560000000001 | G563: 39.116109999999999 | H563: 21.901769999999999 | I563: 39.103200000000001
A564: 2000 NX2-001.FIT | B564: 38554 | D564: 26 | E564: 2000 NX2' | F564: 21.745560000000001 | G564: 27.96611 | H564: 21.74173 | I564: 27.957059999999998
A565: 2000 NX2-002.FIT | B565: 38554 | D565: 26 | E565: 2000 NX2' | F565: 21.745560000000001 | G565: 27.982780000000002 | H565: 21.741710000000001 | I565: 27.956949999999999
A566: 2000 NX2-041.FIT | B566: 38554 | D566: 26 | E566: 2000 NX2' | F566: 21.744440000000001 | G566: 27.982780000000002 | H566: 21.74015 | I566: 27.972480000000001
A567: 2000 NX2-044.FIT | B567: 38554 | D567: 26 | E567: 2000 NX2' | F567: 21.74333 | G567: 27.982780000000002 | H567: 21.73986 | I567: 27.972069999999999
A568: 2000 NX2-A.fits | B568: 38554 | D568: 338 | E568: 2000 NX2' | F568: 21.745560000000001 | G568: 27.96611 | H568: 21.741669999999999 | I568: 27.957730000000002
A569: 2000 NX2-B.fits | B569: 38554 | D569: 312 | E569: 2000 NX2' | F569: 21.745560000000001 | G569: 27.96611 | H569: 21.742840000000001 | I569: 27.955480000000001
A570: 2000 NX2-C.fits | B570: 38554 | D570: 338 | E570: 2000 NX2' | F570: 21.744440000000001 | G570: 27.982780000000002 | H570: 21.740079999999999 | I570: 27.973230000000001
A571: 2000 LY2-A.fits | B571: 38554 | D571: 182 | E571: 2000 LY2' | F571: 21.905560000000001 | G571: 39.099440000000001 | H571: 21.902090000000001 | I571: 39.084580000000003
A572: 2000 LY2-B.fits | B572: 38554 | D572: 260 | E572: 2000 LY2' | F572: 21.905560000000001 | G572: 39.116109999999999 | H572: 21.90081 | I572: 39.103830000000002
A573: 2000 LY2-COMBO.fits | B573: 38554 | D573: 728 | E573: 2000 LY2' | F573: 21.905560000000001 | G573: 39.099440000000001 | H573: 21.902090000000001 | I573: 39.084580000000003
A574: 2000 NX2-No trackA.fits | B574: 38554 | D574: 312 | E574: 2000 NX2' | F574: 21.745560000000001 | G574: 27.96611 | H574: 21.742899999999999 | I574: 27.95478
A575: 2000 LY2-036.FIT | B575: 38554 | D575: 26 | E575: 2000 LY2' | F575: 21.905560000000001 | G575: 39.116109999999999 | H575: 21.734279999999998 | I575: 27.816269999999999
A576: 2000 LY2-037.FIT | B576: 38554 | D576: 26 | E576: 2000 LY2' | F576: 21.905560000000001 | G576: 39.116109999999999 | H576: 21.734300000000001 | I576: 27.816410000000001
A577: 2000 NX2-021.FIT | B577: 38554 | D577: 26 | E577: 2000 NX2' | F577: 21.745560000000001 | G577: 27.96611 | H577: 21.742899999999999 | I577: 27.95478
A578: 2000 NX2-023.FIT | B578: 38554 | D578: 26 | E578: 2000 NX2' | F578: 21.746670000000002 | G578: 27.96611 | H578: 21.743369999999999 | I578: 27.954540000000001
A579: 2000 LJ12-002.FIT | B579: 38597 | D579: 50 | E579: '2000 LJ12' | F579: 22.26389 | G579: 31.85417 | H579: 22.265429999999999 | I579: 31.866340000000001
A580: 2000 LJ12-004.FIT | B580: 38597 | D580: 50 | E580: '2000 LJ12' | F580: 22.260829999999999 | G580: 31.85389 | H580: 22.256789999999999 | I580: 31.825099999999999
A581: 2000 LJ12-005.FIT | B581: 38597 | D581: 50 | E581: '2000 LJ12' | F581: 22.260829999999999 | G581: 31.85472 | H581: 22.25712 | I581: 31.8245
A582: 2001 QG151-002.FIT | B582: 38597 | D582: 50 | E582: '2001 QG151' | F582: 22.864439999999998 | G582: 28.99306 | H582: 22.860510000000001 | I582: 28.96199
A583: 2001 QG151-004.FIT | B583: 38597 | D583: 50 | E583: '2001 QG151' | F583: 22.862220000000001 | G583: 29.005279999999999 | H583: 22.859480000000001 | I583: 28.967079999999999
A584: 2001 QG151-006.FIT | B584: 38597 | D584: 50 | E584: '2001 QG151' | F584: 22.863060000000001 | G584: 29.001940000000001 | H584: 22.859470000000002 | I584: 28.970690000000001
A585: 2000 UQ18-001.FIT | B585: 38598 | D585: 30 | E585: '2000 UQ18' | F585: 21.376110000000001 | G585: 7.2072200000000004 | H585: 21.371359999999999 | I585: 7.1761299999999997
A586: 2000 UQ18-002.FIT | B586: 38598 | D586: 30 | E586: '2000 UQ18' | F586: 21.376390000000001 | G586: 7.2011099999999999 | H586: 21.371490000000001 | I586: 7.1757200000000001
A587: 1998 HG96-002.FIT | B587: 38598 | D587: 30 | E587: '1998 HG96' | F587: 21.503060000000001 | G587: 7.3316699999999999 | H587: 21.498480000000001 | I587: 7.3057100000000004
A588: 1998 HG96-008.FIT | B588: 38598 | D588: 30 | E588: '1998 HG96' | F588: 21.503329999999998 | G588: 7.3280599999999998 | H588: 21.498339999999999 | I588: 7.3021500000000001
A589: 2000 UQ18-007.FIT | B589: 38598 | D589: 30 | E589: '2000 UQ18' | F589: 21.376670000000001 | G589: 7.2050000000000001 | H589: 21.371320000000001 | I589: 7.1878599999999997
A590: 2000 UQ18-008.FIT | B590: 38598 | D590: 30 | E590: '2000 UQ18' | F590: 21.376110000000001 | G590: 7.2130599999999996 | H590: 21.371400000000001 | I590: 7.1876300000000004
A591: 2000 WA73-001.FIT | B591: 38598 | D591: 30 | E591: '2000 WA73' | F591: 21.470559999999999 | G591: 7.3047199999999997 | H591: 21.464770000000001 | I591: 7.2853199999999996
A592: 2000 WA73-002.FIT | B592: 38598 | D592: 30 | E592: '2000 WA73' | F592: 21.468889999999998 | G592: 7.3102799999999997 | H592: 21.464600000000001 | I592: 7.2850599999999996
A593: 1998 HG96-002.FIT | B593: 38600 | D593: 45 | E593: '1998 HG96' | F593: 21.482500000000002 | G593: 6.9824999999999999 | H593: 21.477409999999999 | I593: 6.9567199999999998
A594: 1998 HG96-003.FIT | B594: 38600 | D594: 45 | E594: '1998 HG96' | F594: 21.481390000000001 | G594: 6.9652799999999999 | H594: 21.47681 | I594: 6.9521300000000004
A595: 1998 HG96-006.FIT | B595: 38600 | D595: 45 | E595: '1998 HG96' | F595: 21.481110000000001 | G595: 6.9736099999999999 | H595: 21.47606 | I595: 6.9476000000000004
A596: 2000 PN9-001.FIT | B596: 38600 | D596: 45 | E596: '2000 PN9' | F596: 21.688890000000001 | G596: 6.3644400000000001 | H596: 21.683959999999999 | I596: 6.3361000000000001
A597: 2000 PN9-004.FIT | B597: 38600 | D597: 45 | E597: '2000 PN9' | F597: 21.689170000000001 | G597: 6.34917 | H597: 21.684139999999999 | I597: 6.3222899999999997
A598: 2000 RD97-003.FIT | B598: 38600 | D598: 45 | E598: '2000 RD97' | F598: 21.747499999999999 | G598: 6.34917 | H598: 21.742069999999998 | I598: 6.31257
A599: 2000 RD97-005.FIT | B599: 38600 | D599: 45 | E599: '2000 RD97' | F599: 21.746670000000002 | G599: 6.1794399999999996 | H599: 21.74249 | I599: 6.1514499999999996
A600: 2000 XW38-001.FIT | B600: 38600 | D600: 45 | E600: '2000 XW38' | F600: 21.455279999999998 | G600: 6.6997200000000001 | H600: 21.45045 | I600: 6.6594300000000004
A601: 2000 XW38-006.FIT | B601: 38600 | D601: 45 | E601: '2000 XW38' | F601: 21.455829999999999 | G601: 6.6888899999999998 | H601: 21.45045 | I601: 6.6629699999999996
A602: 2000 GL126-001.FIT | B602: 38600 | D602: 45 | E602: '2000 GL126' | F602: 21.765000000000001 | G602: 6.23611 | H602: 21.76023 | I602: 6.20749
A603: 2000 GL126-004.FIT | B603: 38600 | D603: 45 | E603: '2000 GL126' | F603: 21.761669999999999 | G603: 6.1924999999999999 | H603: 21.756609999999998 | I603: 6.1653500000000001
A604: 2004 QF1-B.fits | B604: 38601 | D604: 270 | E604: '2004 QF1' | F604: 23.669720000000002 | G604: 19.79806 | H604: 23.666699999999999 | I604: 19.795089999999998
A605: 2004 QF1-C.fits | B605: 38601 | D605: 270 | E605: '2004 QF1' | F605: 23.668060000000001 | G605: 19.80611 | H605: 23.66489 | I605: 19.804860000000001
A606: 2002 EZ2-C.fits | B606: 38601 | D606: 270 | E606: '2002 EZ2' | F606: 22.76972 | G606: 16.33417 | H606: 22.762460000000001 | I606: 16.270910000000001
A607: 2002 EZ2-A.fits | B607: 38601 | D607: 240 | E607: '2002 EZ2' | F607: 22.77 | G607: 16.352499999999999 | H607: 22.76559 | I607: 16.316770000000002
A608: 2004 QF1-024.FIT | B608: 38607 | D608: 30 | E608: '2004 QF1' | F608: 23.238330000000001 | G608: 22.609169999999999 | H608: 23.234210000000001 | I608: 22.576820000000001
A609: 2004 QF1-025.FIT | B609: 38607 | D609: 30 | E609: '2004 QF1' | F609: 23.238330000000001 | G609: 22.608609999999999 | H609: 23.234249999999999 | I609: 22.576499999999999
A610: SNELLING-027.FIT | B610: 38607 | D610: 30 | E610: 'SNELLING' | F610: 22.438610000000001 | G610: 15.8 | H610: 22.433779999999999 | I610: 15.76953
A611: SNELLING-028.FIT | B611: 38607 | D611: 30 | E611: 'SNELLING' | F611: 22.43778 | G611: 15.799440000000001 | H611: 22.43385 | I611: 15.769159999999999
A612: 2005 RK3-001.FIT | B612: 38609 | D612: 40 | E612: '2005 RK3' | F612: 22.397220000000001 | G612: 33.279170000000001 | H612: 22.390889999999999 | I612: 33.248060000000002
A613: 2005 RK3-003.FIT | B613: 38609 | D613: 40 | E613: '2005 RK3' | F613: 22.395 | G613: 33.228059999999999 | H613: 22.390930000000001 | I613: 33.247660000000003
A614: 1968 OK-007.FIT | B614: 38617 | D614: 30 | E614: '1968 OK' | F614: 22.65278 | G614: 25.876390000000001 | H614: 22.648900000000001 | I614: 25.867319999999999
A615: 1968 OK-014.FIT | B615: 38617 | D615: 30 | E615: '1968 OK' | F615: 22.65333 | G615: 25.89667 | H615: 22.648720000000001 | I615: 25.8657
A616: 2000 QL217-A Stack.fits | B616: 38617 | D616: 180 | E616: '2000 QL217' | F616: 22.148890000000002 | G616: 24.645 | H616: 22.142469999999999 | I616: 24.596879999999999
A617: 2000 QL217-001.FIT | B617: 38617 | D617: 30 | E617: '2000 QL217' | F617: 22.148890000000002 | G617: 24.645 | H617: 22.142469999999999 | I617: 24.596879999999999
A618: 2004 QF1-015.FIT | B618: 38617 | D618: 30 | E618: '2004 QF1' | F618: 22.456939999999999 | G618: 25.790559999999999 | H618: 22.452470000000002 | I618: 25.760339999999999
A619: 2004 QF1-C Stack.fits | B619: 38617 | D619: 150 | E619: '2004 QF1' | F619: 22.45722 | G619: 25.795000000000002 | H619: 22.452449999999999 | I619: 25.761209999999998
A620: 2000 QL217-002.FIT | B620: 38620 | D620: 30 | E620: '2000 QL217' | F620: 22.128889999999998 | G620: 24.151389999999999 | H620: 22.124780000000001 | I620: 24.12209
A621: 2000 QL217-003.FIT | B621: 38620 | D621: 30 | E621: '2000 QL217' | F621: 22.128609999999998 | G621: 24.151109999999999 | H621: 22.124860000000002 | I621: 24.121600000000001
A622: 2000 WT150-011.FIT | B622: 38620 | D622: 30 | E622: '2000 WT150' | F622: 22.017779999999998 | G622: 24.883330000000001 | H622: 22.013169999999999 | I622: 24.858450000000001
A623: 2000 WT150-012.FIT | B623: 38620 | D623: 30 | E623: '2000 WT150' | F623: 22.017779999999998 | G623: 24.886939999999999 | H623: 22.013249999999999 | I623: 24.858049999999999
A624: 2000 TJ1-010.FIT | B624: 38620 | D624: 30 | E624: '2000 TJ1' | F624: 1.2830600000000001 | G624: 24.217780000000001 | H624: 1.2775300000000001 | I624: 24.18674
A625: 2000 TJ1-B.fits | B625: 38620 | D625: 180 | E625: '2000 TJ1' | F625: 1.2825 | G625: 24.218060000000001 | H625: 1.2774300000000001 | I625: 24.186910000000001
A626: 2004 QF1-001.FIT | B626: 38622 | D626: 40 | E626: '2004 QF1' | F626: 22.07694 | G626: 26.626670000000001 | H626: 22.071760000000001 | I626: 26.597490000000001
A627: 2004 QF1-A.fits | B627: 38622 | D627: 120 | E627: '2004 QF1' | F627: 22.07694 | G627: 26.626670000000001 | H627: 22.071760000000001 | I627: 26.597490000000001
A628: 2000 HN29-003.FIT | B628: 38622 | D628: 40 | E628: '2000 HN29' | F628: 23.428889999999999 | G628: 17.149439999999998 | H628: 23.42381 | I628: 17.118829999999999
A629: 2000 HN29-006.FIT | B629: 38622 | D629: 40 | E629: '2000 HN29' | F629: 23.428609999999999 | G629: 17.14611 | H629: 23.422989999999999 | I629: 17.113099999999999
A630: 2000 JK39-002.FIT | B630: 38622 | D630: 40 | E630: '2000 JK39' | F630: 23.450559999999999 | G630: 18.107220000000002 | H630: 23.446359999999999 | I630: 18.074280000000002
A631: 2000 JK39-003.FIT | B631: 38622 | D631: 40 | E631: '2000 JK39' | F631: 23.45111 | G631: 18.10417 | H631: 23.446190000000001 | I631: 18.070930000000001
A632: 2000 JK39-005.FIT | B632: 38622 | D632: 40 | E632: '2000 JK39' | F632: 23.448889999999999 | G632: 18.099440000000001 | H632: 23.44472 | I632: 18.066669999999998
A633: 2000 LZ29-002.FIT | B633: 38622 | D633: 40 | E633: '2000 LZ29' | F633: 23.528890000000001 | G633: 20.363890000000001 | H633: 23.523540000000001 | I633: 20.33098
A634: 2000 LZ29-004.FIT | B634: 38622 | D634: 40 | E634: '2000 LZ29' | F634: 23.529440000000001 | G634: 20.36139 | H634: 23.523540000000001 | I634: 20.328510000000001
A635: 2000 RJ50-004.FIT | B635: 38622 | D635: 40 | E635: '2000 RJ50' | F635: 23.426390000000001 | G635: 19.753889999999998 | H635: 23.42117 | I635: 19.72119
A636: 2000 RJ50-006.FIT | B636: 38622 | D636: 40 | E636: '2000 RJ50' | F636: 23.424440000000001 | G636: 19.746110000000002 | H636: 23.419460000000001 | I636: 19.713239999999999
A637: 2001 XZ50-002.FIT | B637: 38622 | D637: 40 | E637: '2001 XZ50' | F637: 23.598330000000001 | G637: 23.162780000000001 | H637: 23.594069999999999 | I637: 23.129660000000001
A638: 2001 XZ50-003.FIT | B638: 38622 | D638: 40 | E638: '2001 XZ50' | F638: 23.594169999999998 | G638: 23.140560000000001 | H638: 23.593530000000001 | I638: 23.143329999999999
A639: 2001 XZ50-006.FIT | B639: 38622 | D639: 40 | E639: '2001 XZ50' | F639: 23.594719999999999 | G639: 23.178609999999999 | H639: 23.590589999999999 | I639: 23.14527
A640: 2004 FN18-002.FIT | B640: 38622 | D640: 40 | E640: '2004 FN18' | F640: 23.058060000000001 | G640: 30.74194 | H640: 23.053529999999999 | I640: 30.710139999999999
A641: 2004 FN18-004.FIT | B641: 38622 | D641: 40 | E641: '2004 FN18' | F641: 23.059719999999999 | G641: 30.73583 | H641: 23.0519 | I641: 30.702829999999999